timestamp	sharpe	trades	max_dd_pct	pf	cagr_pct	params_changed	status	description
2026-03-16T00:12:10	0.3905	211	5.98	7.5744	35.74	adx_threshold=20.0	discard	adx_threshold: 25.0→20.0
2026-03-16T00:13:22	0.4071	205	6.22	10.0669	40.02	ema_touch_pct=0.005	discard	ema_touch_pct: 0.01→0.005
2026-03-16T00:13:22	0.3899	210	5.91	7.8732	36.03	ema_touch_pct=0.015	discard	ema_touch_pct: 0.01→0.015
2026-03-16T00:13:22	0.3910	214	6.14	8.3617	36.38	ema_touch_pct=0.02	discard	ema_touch_pct: 0.01→0.02
2026-03-16T00:14:28	0.3652	197	4.87	10.4717	23.23	atr_stop_mult=3.0	discard	atr_stop_mult: 1.5→3.0
2026-03-16T00:14:28	0.3826	200	5.19	10.5877	28.07	atr_stop_mult=2.5	discard	atr_stop_mult: 1.5→2.5
2026-03-16T00:14:28	0.4013	204	6.12	9.6634	32.73	atr_stop_mult=2.0	discard	atr_stop_mult: 1.5→2.0
2026-03-16T00:51:45	0.4423	274	6.39	9.0256	48.26	max_hold_days=7	keep	max_hold_days: None→7 (best of 4)
2026-03-16T00:51:45	0.3921	335	4.38	5.3554	36.21	max_hold_days=5	discard	max_hold_days: None→5
2026-03-16T00:51:45	0.4110	215	6.17	8.6598	41.07	max_hold_days=10	discard	max_hold_days: None→10
2026-03-16T00:51:45	-0.6455	165	4.06	1.4765	2.53	max_hold_days=15	discard	max_hold_days: None→15
2026-03-16T00:52:47	0.4423	274	6.39	9.0256	48.26	sma200_filter=True	discard	sma200_filter: None→True
2026-03-16T00:52:47	0.4375	278	7.77	10.7828	47.90	sma200_filter=False	discard	sma200_filter: None→False
2026-03-16T02:31:09	0.4423	274	6.39	9.0256	48.26		keep	baseline
2026-03-16T02:32:09	0.3888	226	5.48	8.5738	35.27	adx_period=21	discard	adx_period: 7→21
2026-03-16T02:32:09	0.3887	251	8.95	7.3884	35.24	adx_period=14	discard	adx_period: 7→14
2026-03-16T02:32:09	0.3953	268	7.02	6.6521	37.05	adx_period=10	discard	adx_period: 7→10
2026-03-16T02:33:15	0.0926	238	5.50	1.9739	5.50	adx_threshold=35.0	discard	adx_threshold: 25.0→35.0
2026-03-16T02:33:15	-1.5230	256	5.10	1.1686	1.00	adx_threshold=30.0	discard	adx_threshold: 25.0→30.0
2026-03-16T02:33:15	0.3468	272	5.03	3.9496	13.36	adx_threshold=20.0	discard	adx_threshold: 25.0→20.0
2026-03-16T02:34:30	0.4516	273	4.82	11.3187	49.79	ema_touch_pct=0.005	discard	ema_touch_pct: 0.01→0.005
2026-03-16T02:34:30	0.4248	280	8.57	8.7742	44.87	ema_touch_pct=0.015	discard	ema_touch_pct: 0.01→0.015
2026-03-16T02:34:30	0.4361	280	8.19	9.8055	47.48	ema_touch_pct=0.02	discard	ema_touch_pct: 0.01→0.02
2026-03-16T02:35:33	0.4303	257	4.25	14.2820	30.33	atr_stop_mult=3.0	discard	atr_stop_mult: 1.5→3.0
2026-03-16T02:35:33	0.4502	261	4.36	12.8293	34.93	atr_stop_mult=2.5	discard	atr_stop_mult: 1.5→2.5
2026-03-16T02:35:33	0.4375	266	5.92	11.0130	39.31	atr_stop_mult=2.0	discard	atr_stop_mult: 1.5→2.0
2026-03-16T02:36:38	-0.6455	165	4.06	1.4765	2.53	max_hold_days=15	discard	max_hold_days: 7→15
2026-03-16T02:36:38	0.4110	215	6.17	8.6598	41.07	max_hold_days=10	discard	max_hold_days: 7→10
2026-03-16T02:36:38	0.3921	335	4.38	5.3554	36.21	max_hold_days=5	discard	max_hold_days: 7→5
2026-03-16T05:31:06	0.4621	292	4.35	9.3040	53.32		keep	baseline
2026-03-16T05:32:02	0.3931	242	4.86	6.9185	36.46	adx_period=21	discard	adx_period: 7→21
2026-03-16T05:32:02	0.3947	264	6.53	6.2869	36.92	adx_period=14	discard	adx_period: 7→14
2026-03-16T05:32:02	0.4032	285	3.85	5.8376	39.23	adx_period=10	discard	adx_period: 7→10
2026-03-16T05:33:03	0.1359	260	4.56	2.0056	6.10	adx_threshold=35.0	discard	adx_threshold: 25.0→35.0
2026-03-16T05:33:03	0.3920	278	5.06	6.3353	36.23	adx_threshold=30.0	discard	adx_threshold: 25.0→30.0
2026-03-16T05:33:03	0.4641	289	4.41	10.4253	53.93	adx_threshold=20.0	discard	adx_threshold: 25.0→20.0
2026-03-16T05:34:10	0.4565	288	4.45	11.3403	51.57	ema_touch_pct=0.005	discard	ema_touch_pct: 0.01→0.005
2026-03-16T05:34:10	0.4561	292	4.28	9.0001	51.53	ema_touch_pct=0.015	discard	ema_touch_pct: 0.01→0.015
2026-03-16T05:34:10	0.4610	290	4.37	9.2514	52.98	ema_touch_pct=0.02	discard	ema_touch_pct: 0.01→0.02
2026-03-16T05:35:08	0.4607	285	3.26	10.9108	42.81	atr_stop_mult=2.0	discard	atr_stop_mult: 1.5→2.0
2026-03-16T05:35:08	0.4363	273	1.89	14.3156	31.15	atr_stop_mult=3.0	discard	atr_stop_mult: 1.5→3.0
2026-03-16T05:35:08	0.4572	278	2.29	12.6186	36.12	atr_stop_mult=2.5	discard	atr_stop_mult: 1.5→2.5
2026-03-16T05:36:07	0.3942	353	4.57	5.2438	36.86	max_hold_days=5	discard	max_hold_days: 7→5
2026-03-16T05:36:07	0.4251	186	4.35	8.1669	45.10	max_hold_days=15	discard	max_hold_days: 7→15
2026-03-16T05:36:07	0.4246	235	4.64	7.1529	44.95	max_hold_days=10	discard	max_hold_days: 7→10
2026-03-16T10:03:30	0.9193	731	11.30	2.3732	44.49		keep	baseline
2026-03-16T10:04:40	0.4052	244	8.54	6.3510	52.88	adx_period=21	discard	adx_period: 7→21
2026-03-16T10:04:40	0.4162	285	7.26	5.5949	59.35	adx_period=10	discard	adx_period: 7→10
2026-03-16T10:04:40	0.4086	270	8.33	5.5783	54.99	adx_period=14	discard	adx_period: 7→14
2026-03-16T10:05:56	0.4024	282	9.56	5.5167	51.28	adx_threshold=30.0	discard	adx_threshold: 25.0→30.0
2026-03-16T10:05:56	0.3050	260	8.80	1.9305	11.08	adx_threshold=35.0	discard	adx_threshold: 25.0→35.0
2026-03-16T10:05:56	0.4457	290	7.55	10.6115	74.21	adx_threshold=20.0	discard	adx_threshold: 25.0→20.0
2026-03-16T10:07:18	0.4450	291	7.42	9.7712	72.52	ema_touch_pct=0.005	discard	ema_touch_pct: 0.01→0.005
2026-03-16T10:07:18	0.4450	294	7.18	8.9737	73.28	ema_touch_pct=0.015	discard	ema_touch_pct: 0.01→0.015
2026-03-16T10:07:18	0.4481	294	7.78	9.9385	76.74	ema_touch_pct=0.02	discard	ema_touch_pct: 0.01→0.02
2026-03-16T10:08:38	0.4739	285	5.08	8.5449	58.32	atr_stop_mult=2.5	discard	atr_stop_mult: 1.5→2.5
2026-03-16T10:08:38	0.4743	285	5.94	9.2229	68.59	atr_stop_mult=2.0	discard	atr_stop_mult: 1.5→2.0
2026-03-16T10:08:38	0.4619	286	4.69	8.8489	51.60	atr_stop_mult=3.0	discard	atr_stop_mult: 1.5→3.0
2026-03-16T10:09:56	0.4478	189	6.89	13.5676	76.58	max_hold_days=15	discard	max_hold_days: 7→15
2026-03-16T10:09:56	0.4464	234	7.98	11.7270	75.06	max_hold_days=10	discard	max_hold_days: 7→10
2026-03-16T10:09:56	0.4045	351	7.49	4.6585	52.57	max_hold_days=5	discard	max_hold_days: 7→5
2026-03-16T13:03:33	0.9517	731	10.92	2.4566	46.40		keep	baseline
2026-03-16T13:04:40	0.4061	244	8.46	6.5345	53.44	adx_period=21	discard	adx_period: 7→21
2026-03-16T13:04:40	0.4094	270	7.94	5.6866	55.47	adx_period=14	discard	adx_period: 7→14
2026-03-16T13:04:40	0.4169	285	7.08	5.7121	59.83	adx_period=10	discard	adx_period: 7→10
2026-03-16T13:05:54	0.3177	260	8.35	1.9741	11.47	adx_threshold=35.0	discard	adx_threshold: 25.0→35.0
2026-03-16T13:05:54	0.4033	282	9.47	5.6530	51.86	adx_threshold=30.0	discard	adx_threshold: 25.0→30.0
2026-03-16T13:05:54	0.4459	290	7.41	10.8423	74.63	adx_threshold=20.0	discard	adx_threshold: 25.0→20.0
2026-03-16T13:07:12	0.4449	291	7.32	9.7593	72.63	ema_touch_pct=0.005	discard	ema_touch_pct: 0.01→0.005
2026-03-16T13:07:12	0.4452	294	7.52	9.1297	73.70	ema_touch_pct=0.015	discard	ema_touch_pct: 0.01→0.015
2026-03-16T13:07:12	0.4483	294	7.67	10.0704	76.98	ema_touch_pct=0.02	discard	ema_touch_pct: 0.01→0.02
2026-03-16T13:08:24	0.4628	286	4.63	8.9724	51.92	atr_stop_mult=3.0	discard	atr_stop_mult: 1.5→3.0
2026-03-16T13:08:24	0.4750	285	5.01	8.6524	58.75	atr_stop_mult=2.5	discard	atr_stop_mult: 1.5→2.5
2026-03-16T13:08:24	0.4748	285	5.99	9.3624	68.90	atr_stop_mult=2.0	discard	atr_stop_mult: 1.5→2.0
2026-03-16T13:09:35	0.4479	189	7.21	13.6890	76.69	max_hold_days=15	discard	max_hold_days: 7→15
2026-03-16T13:09:35	0.4056	351	7.25	4.6709	53.25	max_hold_days=5	discard	max_hold_days: 7→5
2026-03-16T13:09:35	0.4473	234	7.67	12.1029	76.03	max_hold_days=10	discard	max_hold_days: 7→10
