timestamp	sharpe	trades	max_dd_pct	pf	cagr_pct	params_changed	status	description
2026-03-11T11:44:37	-0.9127	205	5.33	1.3151	1.73		keep	baseline
2026-03-11T11:48:12	-1.6547	104	6.22	1.3263	1.03		keep	baseline
2026-03-11T12:40:41	-1.6547	104	6.22	1.3263	1.03		keep	baseline
2026-03-11T12:49:41	-1.6547	104	6.22	1.3263	1.03		keep	baseline
2026-03-11T14:54:56	-1.1303	322	9.36	1.0100	0.14		keep	baseline
2026-03-11T23:53:32	-1.1303	322	9.36	1.0100	0.14		keep	baseline
2026-03-12T00:15:55	0.4934	390	6.43	2.0156	12.92	adx_period=7	keep	adx_period: None→7 (best of 4)
2026-03-12T00:15:55	-0.7641	284	7.47	1.1944	1.81	adx_period=21	discard	adx_period: None→21
2026-03-12T00:15:55	-1.1303	322	9.36	1.0100	0.14	adx_period=14	discard	adx_period: None→14
2026-03-12T00:15:55	-0.2186	361	6.02	1.2632	3.14	adx_period=10	discard	adx_period: None→10
2026-03-12T00:16:53	-0.0426	363	10.85	1.3015	4.11	adx_threshold=30.0	discard	adx_threshold: None→30.0
2026-03-12T00:16:53	-0.0431	310	8.48	1.3576	4.14	adx_threshold=35.0	discard	adx_threshold: None→35.0
2026-03-12T00:16:53	0.4934	390	6.43	2.0156	12.92	adx_threshold=25.0	discard	adx_threshold: None→25.0
2026-03-12T00:16:53	0.4214	411	8.67	4.2529	43.91	adx_threshold=20.0	discard	adx_threshold: None→20.0
2026-03-12T00:17:56	0.1884	377	8.95	1.5641	6.50	ema_touch_pct=0.005	discard	ema_touch_pct: None→0.005
2026-03-12T00:17:56	0.4934	390	6.43	2.0156	12.92	ema_touch_pct=0.01	discard	ema_touch_pct: None→0.01
2026-03-12T00:17:56	0.2790	389	8.63	1.7803	8.47	ema_touch_pct=0.015	discard	ema_touch_pct: None→0.015
2026-03-12T00:17:56	-0.1573	390	7.39	1.3228	3.83	ema_touch_pct=0.02	discard	ema_touch_pct: None→0.02
2026-03-12T00:40:04	0.5793	395	8.07	1.7584	13.06	atr_stop_mult=1.5	keep	atr_stop_mult: None→1.5 (best of 4)
2026-03-12T00:40:04	0.0490	383	4.88	1.6432	5.11	atr_stop_mult=3.0	discard	atr_stop_mult: None→3.0
2026-03-12T00:40:04	0.4934	390	6.43	2.0156	12.92	atr_stop_mult=2.0	discard	atr_stop_mult: None→2.0
2026-03-12T00:40:04	0.2442	385	4.96	1.7249	6.87	atr_stop_mult=2.5	discard	atr_stop_mult: None→2.5
2026-03-12T00:40:57	0.5025	314	10.42	1.8474	16.13	max_hold_days=15	discard	max_hold_days: None→15
2026-03-12T00:40:57	0.3449	523	11.80	1.5215	10.83	max_hold_days=7	discard	max_hold_days: None→7
2026-03-12T00:40:57	0.5793	395	8.07	1.7584	13.06	max_hold_days=10	discard	max_hold_days: None→10
2026-03-12T00:40:57	0.5041	627	11.39	2.7108	25.40	max_hold_days=5	discard	max_hold_days: None→5
2026-03-12T00:41:52	0.5793	395	8.07	1.7584	13.06	sma200_filter=True	discard	sma200_filter: None→True
2026-03-12T00:41:52	0.4357	421	11.75	1.6566	13.67	sma200_filter=False	discard	sma200_filter: None→False
2026-03-12T05:44:41	0.3774	397	5.62	1.7488	8.48		keep	baseline
2026-03-12T06:07:22	0.3909	293	8.65	5.2185	35.88	adx_period=21	discard	adx_period: 7→21 (combined-fail)
2026-03-12T06:07:22	-1.1336	333	7.95	1.0146	0.35	adx_period=14	discard	adx_period: 7→14 (combined-fail)
2026-03-12T06:07:22	-0.1368	369	6.31	1.3641	3.81	adx_period=10	discard	adx_period: 7→10 (combined-fail)
2026-03-12T06:34:03	0.2524	328	9.88	1.7131	8.13	adx_threshold=35.0	discard	adx_threshold: None→35.0 (combined-fail)
2026-03-12T06:34:03	0.2836	379	9.63	1.6946	8.61	adx_threshold=30.0	discard	adx_threshold: None→30.0 (combined-fail)
2026-03-12T06:34:03	0.3774	397	5.62	1.7488	8.48	adx_threshold=25.0	discard	adx_threshold: None→25.0 (combined-fail)
2026-03-12T06:34:03	0.4780	413	8.36	7.5677	57.74	adx_threshold=20.0	discard	adx_threshold: None→20.0 (combined-fail)
2026-03-12T07:00:31	0.5045	403	6.98	3.2863	20.34	ema_touch_pct=0.015	keep	ema_touch_pct: None→0.015 (best of 4)
2026-03-12T07:00:31	0.1133	382	8.40	1.5330	5.68	ema_touch_pct=0.005	discard	ema_touch_pct: None→0.005
2026-03-12T07:00:31	0.3774	397	5.62	1.7488	8.48	ema_touch_pct=0.01	discard	ema_touch_pct: None→0.01
2026-03-12T07:00:31	-0.1827	403	6.99	1.3054	3.71	ema_touch_pct=0.02	discard	ema_touch_pct: None→0.02
2026-03-12T07:01:39	-0.6669	385	6.43	1.3089	2.38	atr_stop_mult=2.0	discard	atr_stop_mult: 1.5→2.0
2026-03-12T07:01:39	0.1181	371	5.23	2.2504	5.84	atr_stop_mult=3.0	discard	atr_stop_mult: 1.5→3.0
2026-03-12T07:01:39	-0.8591	380	5.44	1.3199	2.07	atr_stop_mult=2.5	discard	atr_stop_mult: 1.5→2.5
2026-03-12T07:02:46	0.3295	535	7.86	2.1283	12.90	max_hold_days=7	discard	max_hold_days: None→7
2026-03-12T07:02:46	0.5045	403	6.98	3.2863	20.34	max_hold_days=10	discard	max_hold_days: None→10
2026-03-12T07:02:46	0.4633	632	6.25	2.7708	18.65	max_hold_days=5	discard	max_hold_days: None→5
2026-03-12T07:02:46	0.2024	313	6.98	1.5639	6.78	max_hold_days=15	discard	max_hold_days: None→15
2026-03-12T07:03:51	0.5045	403	6.98	3.2863	20.34	sma200_filter=True	discard	sma200_filter: None→True
2026-03-12T07:03:51	0.2412	415	6.71	1.6496	7.76	sma200_filter=False	discard	sma200_filter: None→False
2026-03-12T10:50:41	0.3314	398	7.01	1.8516	9.14		keep	baseline
2026-03-12T11:12:38	0.3895	308	8.55	4.9889	35.41	adx_period=21	discard	adx_period: 7→21 (combined-fail)
2026-03-12T11:12:38	-0.8822	348	7.14	1.1545	1.45	adx_period=14	discard	adx_period: 7→14 (combined-fail)
2026-03-12T11:12:38	-0.2257	373	6.76	1.3427	3.55	adx_period=10	discard	adx_period: 7→10 (combined-fail)
2026-03-12T11:36:43	0.4147	415	8.17	4.0126	42.13	adx_threshold=20.0	keep	adx_threshold: None→20.0 (best of 4)
2026-03-12T11:36:43	0.0835	345	6.76	1.5310	5.35	adx_threshold=35.0	discard	adx_threshold: None→35.0
2026-03-12T11:36:43	-0.8587	379	7.47	1.1213	1.32	adx_threshold=30.0	discard	adx_threshold: None→30.0
2026-03-12T11:36:43	0.3314	398	7.01	1.8516	9.14	adx_threshold=25.0	discard	adx_threshold: None→25.0
2026-03-12T11:37:48	0.1035	398	9.26	1.4415	5.58	ema_touch_pct=0.005	discard	ema_touch_pct: 0.015→0.005
2026-03-12T11:37:48	0.4087	408	7.57	1.9120	10.90	ema_touch_pct=0.01	discard	ema_touch_pct: 0.015→0.01
2026-03-12T11:37:48	0.4175	415	10.46	3.8606	42.94	ema_touch_pct=0.02	discard	ema_touch_pct: 0.015→0.02
2026-03-12T11:38:50	0.3049	403	5.31	2.1520	9.66	atr_stop_mult=2.0	discard	atr_stop_mult: 1.5→2.0
2026-03-12T11:38:50	0.4043	399	5.94	6.2136	35.04	atr_stop_mult=2.5	discard	atr_stop_mult: 1.5→2.5
2026-03-12T11:38:50	0.3801	386	5.36	6.6109	26.90	atr_stop_mult=3.0	discard	atr_stop_mult: 1.5→3.0
2026-03-12T13:25:41	0.4147	415	8.17	4.0126	42.13		keep	baseline
2026-03-12T13:26:44	0.3845	368	12.11	4.1883	34.04	adx_period=21	discard	adx_period: 7→21
2026-03-12T13:26:44	0.3963	388	8.27	4.5570	37.11	adx_period=14	discard	adx_period: 7→14
2026-03-12T13:26:44	0.3956	403	8.13	3.9799	36.97	adx_period=10	discard	adx_period: 7→10
2026-03-12T13:27:43	0.0835	345	6.76	1.5310	5.35	adx_threshold=35.0	discard	adx_threshold: 20.0→35.0
2026-03-12T13:27:43	-0.8587	379	7.47	1.1213	1.32	adx_threshold=30.0	discard	adx_threshold: 20.0→30.0
2026-03-12T13:27:43	0.3314	398	7.01	1.8516	9.14	adx_threshold=25.0	discard	adx_threshold: 20.0→25.0
2026-03-12T13:28:49	0.1035	398	9.26	1.4415	5.58	ema_touch_pct=0.005	discard	ema_touch_pct: 0.015→0.005
2026-03-12T13:28:49	0.4087	408	7.57	1.9120	10.90	ema_touch_pct=0.01	discard	ema_touch_pct: 0.015→0.01
2026-03-12T13:28:49	0.4175	415	10.46	3.8606	42.94	ema_touch_pct=0.02	discard	ema_touch_pct: 0.015→0.02
2026-03-12T13:29:54	0.4043	399	5.94	6.2136	35.04	atr_stop_mult=2.5	discard	atr_stop_mult: 1.5→2.5
2026-03-12T13:29:54	0.3801	386	5.36	6.6109	26.90	atr_stop_mult=3.0	discard	atr_stop_mult: 1.5→3.0
2026-03-12T13:29:54	0.3049	403	5.31	2.1520	9.66	atr_stop_mult=2.0	discard	atr_stop_mult: 1.5→2.0
2026-03-12T13:54:48	-0.7455	540	7.72	1.0953	1.59	max_hold_days=7	discard	max_hold_days: None→7 (combined-fail)
2026-03-12T13:54:48	0.4147	415	8.17	4.0126	42.13	max_hold_days=10	discard	max_hold_days: None→10 (combined-fail)
2026-03-12T13:54:48	0.3942	323	11.01	3.9413	39.90	max_hold_days=15	discard	max_hold_days: None→15 (combined-fail)
2026-03-12T13:54:48	0.4543	666	9.88	4.6100	50.84	max_hold_days=5	discard	max_hold_days: None→5 (combined-fail)
2026-03-12T23:55:05	0.4147	415	8.17	4.0126	42.13		keep	baseline
2026-03-12T23:56:06	0.3845	368	12.11	4.1883	34.04	adx_period=21	discard	adx_period: 7→21
2026-03-12T23:56:06	0.3963	388	8.27	4.5570	37.11	adx_period=14	discard	adx_period: 7→14
2026-03-12T23:56:06	0.3956	403	8.13	3.9799	36.97	adx_period=10	discard	adx_period: 7→10
2026-03-12T23:57:03	0.0835	345	6.76	1.5310	5.35	adx_threshold=35.0	discard	adx_threshold: 20.0→35.0
2026-03-12T23:57:03	-0.8587	379	7.47	1.1213	1.32	adx_threshold=30.0	discard	adx_threshold: 20.0→30.0
2026-03-12T23:57:03	0.3314	398	7.01	1.8516	9.14	adx_threshold=25.0	discard	adx_threshold: 20.0→25.0
2026-03-12T23:58:09	0.1035	398	9.26	1.4415	5.58	ema_touch_pct=0.005	discard	ema_touch_pct: 0.015→0.005
2026-03-12T23:58:09	0.4087	408	7.57	1.9120	10.90	ema_touch_pct=0.01	discard	ema_touch_pct: 0.015→0.01
2026-03-12T23:58:09	0.4175	415	10.46	3.8606	42.94	ema_touch_pct=0.02	discard	ema_touch_pct: 0.015→0.02
2026-03-12T23:59:13	0.3049	403	5.31	2.1520	9.66	atr_stop_mult=2.0	discard	atr_stop_mult: 1.5→2.0
2026-03-12T23:59:13	0.4043	399	5.94	6.2136	35.04	atr_stop_mult=2.5	discard	atr_stop_mult: 1.5→2.5
2026-03-12T23:59:13	0.3801	386	5.36	6.6109	26.90	atr_stop_mult=3.0	discard	atr_stop_mult: 1.5→3.0
2026-03-13T00:23:44	-0.7455	540	7.72	1.0953	1.59	max_hold_days=7	discard	max_hold_days: None→7 (combined-fail)
2026-03-13T00:23:44	0.4147	415	8.17	4.0126	42.13	max_hold_days=10	discard	max_hold_days: None→10 (combined-fail)
2026-03-13T00:23:44	0.4543	666	9.88	4.6100	50.84	max_hold_days=5	discard	max_hold_days: None→5 (combined-fail)
2026-03-13T00:23:44	0.3942	323	11.01	3.9413	39.90	max_hold_days=15	discard	max_hold_days: None→15 (combined-fail)
2026-03-13T02:56:00	0.4147	415	8.17	4.0126	42.13		keep	baseline
2026-03-13T02:57:01	0.3845	368	12.11	4.1883	34.04	adx_period=21	discard	adx_period: 7→21
2026-03-13T02:57:01	0.3963	388	8.27	4.5570	37.11	adx_period=14	discard	adx_period: 7→14
2026-03-13T02:57:01	0.3956	403	8.13	3.9799	36.97	adx_period=10	discard	adx_period: 7→10
2026-03-13T02:57:59	0.0835	345	6.76	1.5310	5.35	adx_threshold=35.0	discard	adx_threshold: 20.0→35.0
2026-03-13T02:57:59	-0.8587	379	7.47	1.1213	1.32	adx_threshold=30.0	discard	adx_threshold: 20.0→30.0
2026-03-13T02:57:59	0.3314	398	7.01	1.8516	9.14	adx_threshold=25.0	discard	adx_threshold: 20.0→25.0
2026-03-13T02:59:05	0.1035	398	9.26	1.4415	5.58	ema_touch_pct=0.005	discard	ema_touch_pct: 0.015→0.005
2026-03-13T02:59:05	0.4087	408	7.57	1.9120	10.90	ema_touch_pct=0.01	discard	ema_touch_pct: 0.015→0.01
2026-03-13T02:59:05	0.4175	415	10.46	3.8606	42.94	ema_touch_pct=0.02	discard	ema_touch_pct: 0.015→0.02
2026-03-13T03:00:11	0.3049	403	5.31	2.1520	9.66	atr_stop_mult=2.0	discard	atr_stop_mult: 1.5→2.0
2026-03-13T03:00:11	0.3801	386	5.36	6.6109	26.90	atr_stop_mult=3.0	discard	atr_stop_mult: 1.5→3.0
2026-03-13T03:00:11	0.4043	399	5.94	6.2136	35.04	atr_stop_mult=2.5	discard	atr_stop_mult: 1.5→2.5
2026-03-13T03:24:52	0.3942	323	11.01	3.9413	39.90	max_hold_days=15	discard	max_hold_days: None→15 (combined-fail)
2026-03-13T03:24:52	0.4147	415	8.17	4.0126	42.13	max_hold_days=10	discard	max_hold_days: None→10 (combined-fail)
2026-03-13T03:24:52	-0.7455	540	7.72	1.0953	1.59	max_hold_days=7	discard	max_hold_days: None→7 (combined-fail)
2026-03-13T03:24:52	0.4543	666	9.88	4.6100	50.84	max_hold_days=5	discard	max_hold_days: None→5 (combined-fail)
2026-03-13T05:35:11	0.4017	416	7.17	4.1981	38.80		keep	baseline
2026-03-13T05:36:12	0.3902	368	11.04	4.4893	35.62	adx_period=21	discard	adx_period: 7→21
2026-03-13T05:36:12	0.4015	389	8.02	4.9103	38.55	adx_period=14	discard	adx_period: 7→14
2026-03-13T05:36:12	0.4003	402	7.66	4.2152	38.21	adx_period=10	discard	adx_period: 7→10
2026-03-13T05:59:52	0.4408	399	6.68	2.1019	10.94	adx_threshold=25.0	keep	adx_threshold: 20.0→25.0 (best of 3)
2026-03-13T05:59:52	0.1535	344	6.41	1.6697	6.38	adx_threshold=35.0	discard	adx_threshold: 20.0→35.0
2026-03-13T05:59:52	-0.6003	378	6.82	1.2302	2.38	adx_threshold=30.0	discard	adx_threshold: 20.0→30.0
2026-03-13T06:24:04	0.5558	398	6.33	2.2650	13.67	ema_touch_pct=0.01	keep	ema_touch_pct: 0.015→0.01 (best of 3)
2026-03-13T06:24:04	0.2255	381	7.41	1.6430	6.74	ema_touch_pct=0.005	discard	ema_touch_pct: 0.015→0.005
2026-03-13T06:24:04	0.1563	405	6.62	1.5366	5.77	ema_touch_pct=0.02	discard	ema_touch_pct: 0.015→0.02
2026-03-13T06:25:02	0.3965	378	5.48	6.3176	33.48	atr_stop_mult=2.5	discard	atr_stop_mult: 1.5→2.5
2026-03-13T06:25:02	-1.2696	361	3.99	1.5367	2.35	atr_stop_mult=3.0	discard	atr_stop_mult: 1.5→3.0
2026-03-13T06:25:02	0.4579	386	4.54	2.7404	13.23	atr_stop_mult=2.0	discard	atr_stop_mult: 1.5→2.0
2026-03-13T06:26:02	-0.1240	520	6.99	1.3493	4.23	max_hold_days=7	discard	max_hold_days: None→7
2026-03-13T06:26:02	0.1644	311	7.96	1.5434	6.35	max_hold_days=15	discard	max_hold_days: None→15
2026-03-13T06:26:02	0.5558	398	6.33	2.2650	13.67	max_hold_days=10	discard	max_hold_days: None→10
2026-03-13T06:26:02	0.5049	629	8.17	2.9107	19.98	max_hold_days=5	discard	max_hold_days: None→5
2026-03-13T06:27:01	0.5558	398	6.33	2.2650	13.67	sma200_filter=True	discard	sma200_filter: None→True
2026-03-13T06:27:01	0.4332	416	7.28	1.9523	11.36	sma200_filter=False	discard	sma200_filter: None→False
2026-03-13T10:01:14	0.1886	208	3.71	2.1248	6.41		keep	baseline
2026-03-13T10:34:14	0.3901	164	7.51	8.2161	35.63	adx_period=21	keep	adx_period: 7→21 (best of 3)
2026-03-13T10:34:14	-1.5356	189	5.14	1.1349	0.70	adx_period=14	discard	adx_period: 7→14
2026-03-13T10:34:14	-0.3920	193	4.63	1.5647	2.95	adx_period=10	discard	adx_period: 7→10
2026-03-13T10:35:10	-2.7341	87	3.36	1.2710	0.57	adx_threshold=35.0	discard	adx_threshold: 25.0→35.0
2026-03-13T10:35:10	-1.5270	136	3.86	1.3955	1.35	adx_threshold=30.0	discard	adx_threshold: 25.0→30.0
2026-03-13T10:35:10	0.3869	194	10.86	6.3842	34.75	adx_threshold=20.0	discard	adx_threshold: 25.0→20.0
2026-03-13T10:36:06	0.3860	158	6.49	9.3354	34.51	ema_touch_pct=0.005	discard	ema_touch_pct: 0.01→0.005
2026-03-13T10:36:06	0.3930	172	6.02	7.7950	36.96	ema_touch_pct=0.015	discard	ema_touch_pct: 0.01→0.015
2026-03-13T10:36:06	0.3914	177	8.34	7.3498	35.98	ema_touch_pct=0.02	discard	ema_touch_pct: 0.01→0.02
2026-03-13T10:36:58	-1.7745	158	2.32	1.4529	1.53	atr_stop_mult=2.0	discard	atr_stop_mult: 1.5→2.0
2026-03-13T10:36:58	0.3703	149	5.43	12.7467	25.48	atr_stop_mult=3.0	discard	atr_stop_mult: 1.5→3.0
2026-03-13T10:36:58	0.3819	154	5.95	12.2766	30.54	atr_stop_mult=2.5	discard	atr_stop_mult: 1.5→2.5
2026-03-13T10:37:49	0.3922	213	5.81	8.2525	36.20	max_hold_days=7	discard	max_hold_days: None→7
2026-03-13T10:37:49	0.3931	256	4.20	7.0004	36.45	max_hold_days=5	discard	max_hold_days: None→5
2026-03-13T10:37:49	0.3901	164	7.51	8.2161	35.63	max_hold_days=10	discard	max_hold_days: None→10
2026-03-13T10:37:49	0.3850	133	9.00	9.4641	34.22	max_hold_days=15	discard	max_hold_days: None→15
2026-03-13T10:38:42	0.3905	167	7.52	8.1799	35.74	sma200_filter=False	discard	sma200_filter: None→False
2026-03-13T10:38:42	0.3901	164	7.51	8.2161	35.63	sma200_filter=True	discard	sma200_filter: None→True
2026-03-13T13:00:59	0.3901	164	7.51	8.2161	35.63		keep	baseline
2026-03-13T13:01:56	-1.5356	189	5.14	1.1349	0.70	adx_period=14	discard	adx_period: 21→14
2026-03-13T13:01:56	-0.3920	193	4.63	1.5647	2.95	adx_period=10	discard	adx_period: 21→10
2026-03-13T13:01:56	0.1886	208	3.71	2.1248	6.41	adx_period=7	discard	adx_period: 21→7
2026-03-13T13:02:48	-2.7341	87	3.36	1.2710	0.57	adx_threshold=35.0	discard	adx_threshold: 25.0→35.0
2026-03-13T13:02:48	-1.5270	136	3.86	1.3955	1.35	adx_threshold=30.0	discard	adx_threshold: 25.0→30.0
2026-03-13T13:02:48	0.3869	194	10.86	6.3842	34.75	adx_threshold=20.0	discard	adx_threshold: 25.0→20.0
2026-03-13T13:03:46	0.3860	158	6.49	9.3354	34.51	ema_touch_pct=0.005	discard	ema_touch_pct: 0.01→0.005
2026-03-13T13:03:46	0.3930	172	6.02	7.7950	36.96	ema_touch_pct=0.015	discard	ema_touch_pct: 0.01→0.015
2026-03-13T13:03:46	0.3914	177	8.34	7.3498	35.98	ema_touch_pct=0.02	discard	ema_touch_pct: 0.01→0.02
2026-03-13T13:04:38	0.3819	154	5.95	12.2766	30.54	atr_stop_mult=2.5	discard	atr_stop_mult: 1.5→2.5
2026-03-13T13:04:38	-1.7745	158	2.32	1.4529	1.53	atr_stop_mult=2.0	discard	atr_stop_mult: 1.5→2.0
2026-03-13T13:04:38	0.3703	149	5.43	12.7467	25.48	atr_stop_mult=3.0	discard	atr_stop_mult: 1.5→3.0
2026-03-13T13:05:30	0.3850	133	9.00	9.4641	34.22	max_hold_days=15	discard	max_hold_days: None→15
2026-03-13T13:05:30	0.3922	213	5.81	8.2525	36.20	max_hold_days=7	discard	max_hold_days: None→7
2026-03-13T13:05:30	0.3931	256	4.20	7.0004	36.45	max_hold_days=5	discard	max_hold_days: None→5
2026-03-13T13:05:30	0.3901	164	7.51	8.2161	35.63	max_hold_days=10	discard	max_hold_days: None→10
2026-03-13T23:03:11	0.3901	164	7.51	8.2161	35.63		keep	baseline
2026-03-13T23:04:10	-1.5356	189	5.14	1.1349	0.70	adx_period=14	discard	adx_period: 21→14
2026-03-13T23:04:10	-0.3920	193	4.63	1.5647	2.95	adx_period=10	discard	adx_period: 21→10
2026-03-13T23:04:10	0.1886	208	3.71	2.1248	6.41	adx_period=7	discard	adx_period: 21→7
2026-03-13T23:05:04	-2.7341	87	3.36	1.2710	0.57	adx_threshold=35.0	discard	adx_threshold: 25.0→35.0
2026-03-13T23:05:04	-1.5270	136	3.86	1.3955	1.35	adx_threshold=30.0	discard	adx_threshold: 25.0→30.0
2026-03-13T23:05:04	0.3869	194	10.86	6.3842	34.75	adx_threshold=20.0	discard	adx_threshold: 25.0→20.0
2026-03-13T23:06:02	0.3860	158	6.49	9.3354	34.51	ema_touch_pct=0.005	discard	ema_touch_pct: 0.01→0.005
2026-03-13T23:06:02	0.3930	172	6.02	7.7950	36.96	ema_touch_pct=0.015	discard	ema_touch_pct: 0.01→0.015
2026-03-13T23:06:02	0.3914	177	8.34	7.3498	35.98	ema_touch_pct=0.02	discard	ema_touch_pct: 0.01→0.02
2026-03-13T23:06:55	0.3703	149	5.43	12.7467	25.48	atr_stop_mult=3.0	discard	atr_stop_mult: 1.5→3.0
2026-03-13T23:06:55	-1.7745	158	2.32	1.4529	1.53	atr_stop_mult=2.0	discard	atr_stop_mult: 1.5→2.0
2026-03-13T23:06:55	0.3819	154	5.95	12.2766	30.54	atr_stop_mult=2.5	discard	atr_stop_mult: 1.5→2.5
2026-03-13T23:07:51	0.3901	164	7.51	8.2161	35.63	max_hold_days=10	discard	max_hold_days: None→10
2026-03-13T23:07:51	0.3922	213	5.81	8.2525	36.20	max_hold_days=7	discard	max_hold_days: None→7
2026-03-13T23:07:51	0.3850	133	9.00	9.4641	34.22	max_hold_days=15	discard	max_hold_days: None→15
2026-03-13T23:07:51	0.3931	256	4.20	7.0004	36.45	max_hold_days=5	discard	max_hold_days: None→5
2026-03-14T02:03:12	0.3901	164	7.51	8.2161	35.63		keep	baseline
2026-03-14T02:04:11	-1.5356	189	5.14	1.1349	0.70	adx_period=14	discard	adx_period: 21→14
2026-03-14T02:04:11	-0.3920	193	4.63	1.5647	2.95	adx_period=10	discard	adx_period: 21→10
2026-03-14T02:04:11	0.1886	208	3.71	2.1248	6.41	adx_period=7	discard	adx_period: 21→7
2026-03-14T02:05:06	-2.7341	87	3.36	1.2710	0.57	adx_threshold=35.0	discard	adx_threshold: 25.0→35.0
2026-03-14T02:05:06	-1.5270	136	3.86	1.3955	1.35	adx_threshold=30.0	discard	adx_threshold: 25.0→30.0
2026-03-14T02:05:06	0.3869	194	10.86	6.3842	34.75	adx_threshold=20.0	discard	adx_threshold: 25.0→20.0
2026-03-14T02:06:03	0.3860	158	6.49	9.3354	34.51	ema_touch_pct=0.005	discard	ema_touch_pct: 0.01→0.005
2026-03-14T02:06:03	0.3930	172	6.02	7.7950	36.96	ema_touch_pct=0.015	discard	ema_touch_pct: 0.01→0.015
2026-03-14T02:06:03	0.3914	177	8.34	7.3498	35.98	ema_touch_pct=0.02	discard	ema_touch_pct: 0.01→0.02
2026-03-14T02:06:56	0.3819	154	5.95	12.2766	30.54	atr_stop_mult=2.5	discard	atr_stop_mult: 1.5→2.5
2026-03-14T02:06:56	0.3703	149	5.43	12.7467	25.48	atr_stop_mult=3.0	discard	atr_stop_mult: 1.5→3.0
2026-03-14T02:06:56	-1.7745	158	2.32	1.4529	1.53	atr_stop_mult=2.0	discard	atr_stop_mult: 1.5→2.0
2026-03-14T02:07:49	0.3850	133	9.00	9.4641	34.22	max_hold_days=15	discard	max_hold_days: None→15
2026-03-14T02:07:49	0.3931	256	4.20	7.0004	36.45	max_hold_days=5	discard	max_hold_days: None→5
2026-03-14T02:07:49	0.3901	164	7.51	8.2161	35.63	max_hold_days=10	discard	max_hold_days: None→10
2026-03-14T02:07:49	0.3922	213	5.81	8.2525	36.20	max_hold_days=7	discard	max_hold_days: None→7
2026-03-14T23:03:06	0.3901	164	7.03	10.1158	35.62		keep	baseline
2026-03-14T23:04:02	-1.7921	187	5.02	1.0536	0.27	adx_period=14	discard	adx_period: 21→14
2026-03-14T23:04:02	-0.4007	193	4.53	1.5608	2.91	adx_period=10	discard	adx_period: 21→10
2026-03-14T23:04:02	0.1886	208	3.71	2.1248	6.41	adx_period=7	discard	adx_period: 21→7
2026-03-14T23:04:56	-1.5270	136	3.86	1.3955	1.35	adx_threshold=30.0	discard	adx_threshold: 25.0→30.0
2026-03-14T23:04:56	-2.7341	87	3.36	1.2710	0.57	adx_threshold=35.0	discard	adx_threshold: 25.0→35.0
2026-03-14T23:04:56	0.3887	194	8.92	9.1725	35.23	adx_threshold=20.0	discard	adx_threshold: 25.0→20.0
2026-03-14T23:05:55	0.3857	158	6.27	11.3285	34.44	ema_touch_pct=0.005	discard	ema_touch_pct: 0.01→0.005
2026-03-14T23:05:55	0.3923	172	5.78	8.9720	36.76	ema_touch_pct=0.015	discard	ema_touch_pct: 0.01→0.015
2026-03-14T23:05:55	0.3908	177	7.86	8.9633	35.82	ema_touch_pct=0.02	discard	ema_touch_pct: 0.01→0.02
2026-03-14T23:06:47	0.3823	154	5.60	14.4780	30.63	atr_stop_mult=2.5	discard	atr_stop_mult: 1.5→2.5
2026-03-14T23:06:47	-1.7745	158	2.32	1.4529	1.53	atr_stop_mult=2.0	discard	atr_stop_mult: 1.5→2.0
2026-03-14T23:06:47	0.3702	149	5.12	15.4577	25.47	atr_stop_mult=3.0	discard	atr_stop_mult: 1.5→3.0
2026-03-14T23:07:39	0.3940	256	4.20	7.0479	36.72	max_hold_days=5	discard	max_hold_days: None→5
2026-03-14T23:07:39	0.3845	133	8.59	13.4274	34.11	max_hold_days=15	discard	max_hold_days: None→15
2026-03-14T23:07:39	0.3901	164	7.03	10.1158	35.62	max_hold_days=10	discard	max_hold_days: None→10
2026-03-14T23:07:39	0.3917	213	5.39	8.6005	36.07	max_hold_days=7	discard	max_hold_days: None→7
2026-03-15T23:33:27	-1.5062	171	5.10	1.1304	0.90		keep	baseline
2026-03-16T00:11:02	0.4110	215	6.17	8.6598	41.07	adx_period=7	keep	adx_period: 21→7 (best of 3)
2026-03-16T00:11:02	-1.5772	198	5.06	1.1388	0.72	adx_period=14	discard	adx_period: 21→14
2026-03-16T00:11:02	0.3940	210	6.75	6.4592	37.15	adx_period=10	discard	adx_period: 21→10
2026-03-16T00:12:10	-1.4265	189	4.14	1.2209	1.09	adx_threshold=35.0	discard	adx_threshold: 25.0→35.0
2026-03-16T00:12:10	-1.4849	200	4.65	1.1923	0.99	adx_threshold=30.0	discard	adx_threshold: 25.0→30.0
