timestamp	sharpe	trades	max_dd_pct	pf	cagr_pct	params_changed	status	description
2026-05-16T14:32:30	1.3520	300	22.02	1.6351	37.71		keep	baseline
2026-05-16T14:34:02	1.0416	312	25.52	1.4942	27.78	max_hold_days=20	discard	max_hold_days=20: push beyond 18
2026-05-16T14:35:33	1.0546	305	26.62	1.5200	27.86	max_hold_days=22	discard	max_hold_days=22: even longer
