timestamp	sharpe	trades	max_dd_pct	pf	cagr_pct	params_changed	status	description
2026-05-01T14:24:45	0.7418	293	20.35	1.4491	19.50		keep	baseline
2026-05-01T14:31:23	0.7418	293	20.35	1.4491	19.50		keep	baseline
2026-05-01T14:36:47	0.7418	293	20.35	1.4491	19.50		keep	baseline
2026-05-01T14:36:56	0.7418	293	20.35	1.4491	19.50		keep	baseline
2026-05-01T14:40:02	0.7322	295	20.35	1.4977	19.21	atr_stop_mult=1.5	discard	tighter stop: 1.5x ATR - reduce DD
2026-05-01T14:40:20	0.7418	293	20.35	1.4491	19.50		keep	baseline
2026-05-01T14:45:23	0.7418	293	20.35	1.4491	19.50		keep	baseline
2026-05-01T14:48:40	0.8683	304	21.52	1.4683	22.86		keep	baseline
2026-05-01T14:50:16	0.8683	304	21.52	1.4683	22.86		keep	baseline
2026-05-01T14:51:35	0.8544	306	21.52	1.5146	22.45	max_hold_days=7	discard	hold longer 5â†’7: more time to revert
2026-05-01T14:52:55	0.8544	306	21.52	1.5146	22.45	max_hold_days=10	discard	hold longer 5â†’10: full recovery window
2026-05-01T14:54:15	0.8544	306	21.52	1.5146	22.45	max_hold_days=3	discard	hold shorter 5â†’3: quick snap-back exit
2026-05-01T14:55:35	0.8544	306	21.52	1.5146	22.45	atr_stop_mult=1.5	discard	tighter stop 2.0â†’1.5: cut losers faster
2026-05-01T14:56:58	0.8544	306	21.52	1.5146	22.45	atr_stop_mult=2.5	discard	looser stop 2.0â†’2.5: avoid whipsaw
2026-05-01T14:59:32	0.8683	304	21.52	1.4683	22.86		keep	baseline
2026-05-09T14:06:11	0.7418	293	20.35	1.4491	19.50		keep	baseline
2026-05-09T14:09:32	0.7418	293	20.35	1.4491	19.50		keep	baseline
2026-05-09T14:12:54	0.7418	293	20.35	1.4491	19.50		keep	baseline
2026-05-09T14:19:18	0.7418	293	20.35	1.4491	19.50		keep	baseline
2026-05-09T14:22:38	0.7322	295	20.35	1.4977	19.21	min_down_days=2	discard	min_down_days 3â†’2: more entry signals
2026-05-09T14:27:54	0.7418	293	20.35	1.4491	19.50		keep	baseline
2026-05-10T14:17:23	0.7418	293	20.35	1.4491	19.50		keep	baseline
2026-05-10T14:21:03	0.7418	293	20.35	1.4491	19.50		keep	baseline
2026-05-10T14:23:55	0.7322	295	20.35	1.4977	19.21	ibs_threshold=0.5	discard	ibs_threshold 1.0â†’0.5: add oversold filter, should improve quality
2026-05-13T14:10:06	0.7418	293	20.35	1.4491	19.50		keep	baseline
2026-05-13T14:13:02	0.7418	293	20.35	1.4491	19.50		keep	baseline
2026-05-13T14:16:26	0.7418	293	20.35	1.4491	19.50		keep	baseline
2026-05-13T14:22:39	0.7418	293	20.35	1.4491	19.50		keep	baseline
2026-05-13T14:25:18	0.7322	295	20.35	1.4977	19.21	min_down_days=4	discard	min_down_days 3â†’4: higher conviction, expect higher quality trades
2026-05-13T14:28:04	0.7322	295	20.35	1.4977	19.21	ibs_threshold=0.3	discard	ibs_threshold 1.0â†’0.3: strict exhaustion filter
2026-05-13T14:30:49	0.7322	295	20.35	1.4977	19.21	sma200_filter=True	discard	sma200_filter Falseâ†’True: only buy above 200-day SMA
