timestamp	sharpe	trades	max_dd_pct	pf	cagr_pct	params_changed	status	description
2026-03-11T11:45:38	0.4161	338	5.28	6.8171	42.33		keep	baseline
2026-03-11T11:48:52	0.4156	249	3.69	8.8005	42.17		keep	baseline
2026-03-11T12:41:38	0.4156	249	3.69	8.8005	42.17		keep	baseline
2026-03-11T12:50:36	0.4156	249	3.69	8.8005	42.17		keep	baseline
2026-03-14T03:14:02	-0.2008	293	3.81	1.8501	3.26		keep	baseline
2026-03-14T03:40:40	-0.1649	338	3.54	1.8298	3.52	band_mult=2.0	keep	band_mult: Noneâ†’2.0 (best of 4)
2026-03-14T03:40:40	-0.2008	293	3.81	1.8501	3.26	band_mult=2.5	discard	band_mult: Noneâ†’2.5
2026-03-14T03:40:40	-2.7017	376	5.18	1.1043	0.34	band_mult=1.5	discard	band_mult: Noneâ†’1.5
2026-03-14T03:40:40	-2.4360	395	5.80	1.1458	0.61	band_mult=1.0	discard	band_mult: Noneâ†’1.0
2026-03-14T05:33:23	-0.1649	338	3.54	1.8298	3.52		keep	baseline
2026-03-14T05:33:54	-0.2008	293	3.81	1.8501	3.26	band_mult=2.5	discard	band_mult: 2.0â†’2.5
2026-03-14T05:33:54	-2.7017	376	5.18	1.1043	0.34	band_mult=1.5	discard	band_mult: 2.0â†’1.5
2026-03-14T05:33:54	-2.4360	395	5.80	1.1458	0.61	band_mult=1.0	discard	band_mult: 2.0â†’1.0
2026-03-14T06:00:10	0.3856	377	3.11	8.0655	30.11	ibs_threshold=0.5	keep	ibs_threshold: Noneâ†’0.5 (best of 3)
2026-03-14T06:00:10	0.2012	309	3.40	2.6898	6.90	ibs_threshold=0.2	discard	ibs_threshold: Noneâ†’0.2
2026-03-14T06:00:10	-0.1649	338	3.54	1.8298	3.52	ibs_threshold=0.3	discard	ibs_threshold: Noneâ†’0.3
2026-03-14T06:00:41	0.3855	389	3.19	7.9405	30.06	range_lookback=20	discard	range_lookback: Noneâ†’20
2026-03-14T06:00:41	0.3862	394	5.64	8.6617	30.16	range_lookback=10	discard	range_lookback: Noneâ†’10
2026-03-14T06:00:41	0.3861	391	5.70	7.7214	30.17	range_lookback=15	discard	range_lookback: Noneâ†’15
2026-03-14T06:00:41	0.3856	377	3.11	8.0655	30.11	range_lookback=25	discard	range_lookback: Noneâ†’25
2026-03-14T06:01:14	0.3856	377	3.11	8.0655	30.11	max_hold_days=7	discard	max_hold_days: Noneâ†’7
2026-03-14T06:01:14	0.3846	408	4.38	7.7387	29.91	max_hold_days=5	discard	max_hold_days: Noneâ†’5
2026-03-14T06:01:14	0.3879	357	2.87	9.0070	30.48	max_hold_days=10	discard	max_hold_days: Noneâ†’10
2026-03-14T06:01:14	-2.2500	459	2.92	1.2521	1.16	max_hold_days=3	discard	max_hold_days: Noneâ†’3
2026-03-14T06:28:39	0.3966	363	1.77	9.1192	28.84	atr_stop_mult=2.5	keep	atr_stop_mult: Noneâ†’2.5 (best of 4)
2026-03-14T06:28:39	0.3856	377	3.11	8.0655	30.11	atr_stop_mult=2.0	discard	atr_stop_mult: Noneâ†’2.0
2026-03-14T06:28:39	0.3867	352	1.95	10.0293	25.26	atr_stop_mult=3.0	discard	atr_stop_mult: Noneâ†’3.0
2026-03-14T06:28:39	0.0107	413	2.86	1.6612	4.67	atr_stop_mult=1.5	discard	atr_stop_mult: Noneâ†’1.5
2026-03-14T06:29:17	0.3966	363	1.77	9.1192	28.84	sma200_filter=True	discard	sma200_filter: Noneâ†’True
2026-03-14T06:29:17	0.3956	402	2.19	7.8114	29.22	sma200_filter=False	discard	sma200_filter: Noneâ†’False
2026-03-14T10:11:05	0.3966	363	1.77	9.1192	28.84		keep	baseline
2026-03-14T10:11:43	0.3745	307	2.82	9.1698	25.80	band_mult=2.5	discard	band_mult: 2.0â†’2.5
2026-03-14T10:11:43	0.3969	386	3.28	8.9772	29.41	band_mult=1.5	discard	band_mult: 2.0â†’1.5
2026-03-14T10:11:43	0.2794	422	2.99	3.0309	8.30	band_mult=1.0	discard	band_mult: 2.0â†’1.0
2026-03-14T10:12:13	0.3913	292	3.88	9.2089	28.03	ibs_threshold=0.2	discard	ibs_threshold: 0.5â†’0.2
2026-03-14T10:12:13	0.3945	323	3.12	9.6106	28.50	ibs_threshold=0.3	discard	ibs_threshold: 0.5â†’0.3
2026-03-14T10:12:46	0.3933	366	4.55	8.5284	28.34	range_lookback=15	discard	range_lookback: Noneâ†’15
2026-03-14T10:12:46	0.3966	363	1.77	9.1192	28.84	range_lookback=25	discard	range_lookback: Noneâ†’25
2026-03-14T10:12:46	0.3745	363	4.88	9.4888	25.81	range_lookback=10	discard	range_lookback: Noneâ†’10
2026-03-14T10:12:46	0.3939	371	2.83	8.7411	28.40	range_lookback=20	discard	range_lookback: Noneâ†’20
2026-03-14T10:13:20	0.3746	392	3.01	8.1794	25.78	max_hold_days=5	discard	max_hold_days: Noneâ†’5
2026-03-14T10:13:20	0.4003	338	1.99	10.3738	29.34	max_hold_days=10	discard	max_hold_days: Noneâ†’10
2026-03-14T10:13:20	0.3966	363	1.77	9.1192	28.84	max_hold_days=7	discard	max_hold_days: Noneâ†’7
2026-03-14T10:13:20	-3.2305	429	3.01	1.2044	0.60	max_hold_days=3	discard	max_hold_days: Noneâ†’3
2026-03-14T10:13:53	0.3856	377	3.11	8.0655	30.11	atr_stop_mult=2.0	discard	atr_stop_mult: 2.5â†’2.0
2026-03-14T10:13:53	0.3867	352	1.95	10.0293	25.26	atr_stop_mult=3.0	discard	atr_stop_mult: 2.5â†’3.0
2026-03-14T10:13:53	0.0107	413	2.86	1.6612	4.67	atr_stop_mult=1.5	discard	atr_stop_mult: 2.5â†’1.5
2026-03-14T23:13:26	0.3966	363	1.77	9.1192	28.84		keep	baseline
2026-03-14T23:14:02	0.3745	307	2.82	9.1698	25.80	band_mult=2.5	discard	band_mult: 2.0â†’2.5
2026-03-14T23:14:02	0.3969	386	3.28	8.9772	29.41	band_mult=1.5	discard	band_mult: 2.0â†’1.5
2026-03-14T23:14:02	0.2794	422	2.99	3.0309	8.30	band_mult=1.0	discard	band_mult: 2.0â†’1.0
2026-03-14T23:14:31	0.3913	292	3.88	9.2089	28.03	ibs_threshold=0.2	discard	ibs_threshold: 0.5â†’0.2
2026-03-14T23:14:31	0.3945	323	3.12	9.6106	28.50	ibs_threshold=0.3	discard	ibs_threshold: 0.5â†’0.3
2026-03-14T23:15:00	0.3749	364	4.39	9.6410	25.82	range_lookback=10	discard	range_lookback: Noneâ†’10
2026-03-14T23:15:00	0.3925	364	4.51	8.5164	28.21	range_lookback=15	discard	range_lookback: Noneâ†’15
2026-03-14T23:15:00	0.3939	371	2.83	8.7411	28.40	range_lookback=20	discard	range_lookback: Noneâ†’20
2026-03-14T23:15:00	0.3966	363	1.77	9.1192	28.84	range_lookback=25	discard	range_lookback: Noneâ†’25
2026-03-14T23:15:32	0.3746	392	3.01	8.1794	25.78	max_hold_days=5	discard	max_hold_days: Noneâ†’5
2026-03-14T23:15:32	0.4003	338	1.99	10.3738	29.34	max_hold_days=10	discard	max_hold_days: Noneâ†’10
2026-03-14T23:15:32	-3.2305	429	3.01	1.2044	0.60	max_hold_days=3	discard	max_hold_days: Noneâ†’3
2026-03-14T23:15:32	0.3966	363	1.77	9.1192	28.84	max_hold_days=7	discard	max_hold_days: Noneâ†’7
2026-03-14T23:16:04	0.0107	413	2.86	1.6612	4.67	atr_stop_mult=1.5	discard	atr_stop_mult: 2.5â†’1.5
2026-03-14T23:16:04	0.3867	352	1.95	10.0293	25.26	atr_stop_mult=3.0	discard	atr_stop_mult: 2.5â†’3.0
2026-03-14T23:16:04	0.3856	377	3.11	8.0655	30.11	atr_stop_mult=2.0	discard	atr_stop_mult: 2.5â†’2.0
2026-03-15T10:43:35	-0.2574	364	2.26	2.0430	3.30		keep	baseline
2026-03-15T11:10:51	0.3934	393	3.98	7.8981	28.36	band_mult=1.5	keep	band_mult: 2.0â†’1.5 (best of 3)
2026-03-15T11:10:51	0.3730	309	3.11	9.2635	25.58	band_mult=2.5	discard	band_mult: 2.0â†’2.5
2026-03-15T11:10:51	0.2813	420	3.32	3.0956	8.34	band_mult=1.0	discard	band_mult: 2.0â†’1.0
2026-03-15T11:11:22	0.3961	342	2.39	8.5956	28.77	ibs_threshold=0.2	discard	ibs_threshold: 0.5â†’0.2
2026-03-15T11:11:22	-3.0898	350	3.81	1.1572	0.55	ibs_threshold=0.3	discard	ibs_threshold: 0.5â†’0.3
2026-03-15T11:11:54	0.3934	393	3.98	7.8981	28.36	range_lookback=25	discard	range_lookback: Noneâ†’25
2026-03-15T11:11:54	0.3938	390	3.97	7.7078	28.40	range_lookback=20	discard	range_lookback: Noneâ†’20
2026-03-15T11:11:54	0.3955	394	3.63	7.6258	28.66	range_lookback=15	discard	range_lookback: Noneâ†’15
2026-03-15T11:11:54	0.3947	399	3.28	7.4607	28.57	range_lookback=10	discard	range_lookback: Noneâ†’10
2026-03-15T11:12:27	0.3946	370	3.65	8.2415	28.56	max_hold_days=10	discard	max_hold_days: Noneâ†’10
2026-03-15T11:12:27	0.3754	432	4.80	8.0837	25.92	max_hold_days=5	discard	max_hold_days: Noneâ†’5
2026-03-15T11:12:27	-3.7188	487	5.76	0.9838	0.01	max_hold_days=3	discard	max_hold_days: Noneâ†’3
2026-03-15T11:12:27	0.3934	393	3.98	7.8981	28.36	max_hold_days=7	discard	max_hold_days: Noneâ†’7
2026-03-15T11:13:00	0.3641	376	4.18	8.7162	22.70	atr_stop_mult=3.0	discard	atr_stop_mult: 2.5â†’3.0
2026-03-15T11:13:00	0.3818	426	6.00	7.0370	29.40	atr_stop_mult=2.0	discard	atr_stop_mult: 2.5â†’2.0
2026-03-15T11:13:00	0.0203	459	4.91	1.6359	4.77	atr_stop_mult=1.5	discard	atr_stop_mult: 2.5â†’1.5
2026-03-15T11:13:39	0.3934	393	3.98	7.8981	28.36	sma200_filter=True	discard	sma200_filter: Noneâ†’True
2026-03-15T11:13:39	0.3777	421	2.47	7.1925	26.26	sma200_filter=False	discard	sma200_filter: Noneâ†’False
2026-03-16T01:10:51	0.3934	393	3.98	7.8981	28.36		keep	baseline
2026-03-16T01:11:29	0.3730	309	3.11	9.2635	25.58	band_mult=2.5	discard	band_mult: 1.5â†’2.5
2026-03-16T01:11:29	-0.2574	364	2.26	2.0430	3.30	band_mult=2.0	discard	band_mult: 1.5â†’2.0
2026-03-16T01:11:29	0.2813	420	3.32	3.0956	8.34	band_mult=1.0	discard	band_mult: 1.5â†’1.0
2026-03-16T01:12:03	0.3961	342	2.39	8.5956	28.77	ibs_threshold=0.2	discard	ibs_threshold: 0.5â†’0.2
2026-03-16T01:12:03	-3.0898	350	3.81	1.1572	0.55	ibs_threshold=0.3	discard	ibs_threshold: 0.5â†’0.3
2026-03-16T01:12:37	0.3955	394	3.63	7.6258	28.66	range_lookback=15	discard	range_lookback: Noneâ†’15
2026-03-16T01:12:37	0.3934	393	3.98	7.8981	28.36	range_lookback=25	discard	range_lookback: Noneâ†’25
2026-03-16T01:12:37	0.3938	390	3.97	7.7078	28.40	range_lookback=20	discard	range_lookback: Noneâ†’20
2026-03-16T01:12:37	0.3947	399	3.28	7.4607	28.57	range_lookback=10	discard	range_lookback: Noneâ†’10
2026-03-16T01:13:13	-3.7188	487	5.76	0.9838	0.01	max_hold_days=3	discard	max_hold_days: Noneâ†’3
2026-03-16T01:13:13	0.3934	393	3.98	7.8981	28.36	max_hold_days=7	discard	max_hold_days: Noneâ†’7
2026-03-16T01:13:13	0.3754	432	4.80	8.0837	25.92	max_hold_days=5	discard	max_hold_days: Noneâ†’5
2026-03-16T01:13:13	0.3946	370	3.65	8.2415	28.56	max_hold_days=10	discard	max_hold_days: Noneâ†’10
2026-03-16T01:13:47	0.3818	426	6.00	7.0370	29.40	atr_stop_mult=2.0	discard	atr_stop_mult: 2.5â†’2.0
2026-03-16T01:13:47	0.0203	459	4.91	1.6359	4.77	atr_stop_mult=1.5	discard	atr_stop_mult: 2.5â†’1.5
2026-03-16T01:13:47	0.3641	376	4.18	8.7162	22.70	atr_stop_mult=3.0	discard	atr_stop_mult: 2.5â†’3.0
2026-03-16T02:53:38	0.3934	393	3.98	7.8981	28.36		keep	baseline
2026-03-16T02:54:17	0.3730	309	3.11	9.2635	25.58	band_mult=2.5	discard	band_mult: 1.5â†’2.5
2026-03-16T02:54:17	-0.2574	364	2.26	2.0430	3.30	band_mult=2.0	discard	band_mult: 1.5â†’2.0
2026-03-16T02:54:17	0.2813	420	3.32	3.0956	8.34	band_mult=1.0	discard	band_mult: 1.5â†’1.0
2026-03-16T02:54:48	0.3961	342	2.39	8.5956	28.77	ibs_threshold=0.2	discard	ibs_threshold: 0.5â†’0.2
2026-03-16T02:54:48	-3.0898	350	3.81	1.1572	0.55	ibs_threshold=0.3	discard	ibs_threshold: 0.5â†’0.3
2026-03-16T02:55:24	0.3934	393	3.98	7.8981	28.36	range_lookback=25	discard	range_lookback: Noneâ†’25
2026-03-16T02:55:24	0.3955	394	3.63	7.6258	28.66	range_lookback=15	discard	range_lookback: Noneâ†’15
2026-03-16T02:55:24	0.3938	390	3.97	7.7078	28.40	range_lookback=20	discard	range_lookback: Noneâ†’20
2026-03-16T02:55:24	0.3947	399	3.28	7.4607	28.57	range_lookback=10	discard	range_lookback: Noneâ†’10
2026-03-16T02:56:01	0.3946	370	3.65	8.2415	28.56	max_hold_days=10	discard	max_hold_days: Noneâ†’10
2026-03-16T02:56:01	-3.7188	487	5.76	0.9838	0.01	max_hold_days=3	discard	max_hold_days: Noneâ†’3
2026-03-16T02:56:01	0.3934	393	3.98	7.8981	28.36	max_hold_days=7	discard	max_hold_days: Noneâ†’7
2026-03-16T02:56:01	0.3754	432	4.80	8.0837	25.92	max_hold_days=5	discard	max_hold_days: Noneâ†’5
2026-03-16T02:56:34	0.3818	426	6.00	7.0370	29.40	atr_stop_mult=2.0	discard	atr_stop_mult: 2.5â†’2.0
2026-03-16T02:56:34	0.3641	376	4.18	8.7162	22.70	atr_stop_mult=3.0	discard	atr_stop_mult: 2.5â†’3.0
2026-03-16T02:56:34	0.0203	459	4.91	1.6359	4.77	atr_stop_mult=1.5	discard	atr_stop_mult: 2.5â†’1.5
2026-03-16T06:20:10	0.3953	403	3.48	7.9379	28.66		keep	baseline
2026-03-16T06:20:50	0.3741	317	3.14	9.1696	25.72	band_mult=2.5	discard	band_mult: 1.5â†’2.5
2026-03-16T06:20:50	-0.2295	375	2.06	2.0687	3.46	band_mult=2.0	discard	band_mult: 1.5â†’2.0
2026-03-16T06:20:50	0.2992	432	2.98	3.1862	8.59	band_mult=1.0	discard	band_mult: 1.5â†’1.0
2026-03-16T06:21:25	0.3950	347	2.48	8.4406	28.57	ibs_threshold=0.2	discard	ibs_threshold: 0.5â†’0.2
2026-03-16T06:21:25	-3.0554	362	3.90	1.1850	0.54	ibs_threshold=0.3	discard	ibs_threshold: 0.5â†’0.3
2026-03-16T06:22:06	0.3958	401	3.49	7.6971	28.69	range_lookback=20	discard	range_lookback: Noneâ†’20
2026-03-16T06:22:06	0.3953	403	3.48	7.9379	28.66	range_lookback=25	discard	range_lookback: Noneâ†’25
2026-03-16T06:22:06	0.3977	406	3.04	7.7472	28.99	range_lookback=15	discard	range_lookback: Noneâ†’15
2026-03-16T06:22:06	0.3966	408	3.07	7.5597	28.79	range_lookback=10	discard	range_lookback: Noneâ†’10
2026-03-16T06:22:42	0.3965	381	3.43	8.3690	28.85	max_hold_days=10	discard	max_hold_days: Noneâ†’10
2026-03-16T06:22:42	0.3953	403	3.48	7.9379	28.66	max_hold_days=7	discard	max_hold_days: Noneâ†’7
2026-03-16T06:22:42	0.3771	441	5.00	8.2925	26.13	max_hold_days=5	discard	max_hold_days: Noneâ†’5
2026-03-16T06:22:42	-3.6948	492	5.90	0.9709	-0.05	max_hold_days=3	discard	max_hold_days: Noneâ†’3
2026-03-16T06:23:20	0.0432	472	4.45	1.6452	4.99	atr_stop_mult=1.5	discard	atr_stop_mult: 2.5â†’1.5
2026-03-16T06:23:20	0.3847	434	5.00	6.9854	29.89	atr_stop_mult=2.0	discard	atr_stop_mult: 2.5â†’2.0
2026-03-16T06:23:20	0.3643	386	4.28	8.4444	22.74	atr_stop_mult=3.0	discard	atr_stop_mult: 2.5â†’3.0
2026-03-16T10:29:41	0.9456	723	13.03	2.4402	46.11		keep	baseline
2026-03-16T10:30:32	-1.3122	347	5.37	1.2205	1.37	band_mult=2.5	discard	band_mult: 1.5â†’2.5
2026-03-16T10:30:32	-0.8388	404	4.73	1.3316	2.40	band_mult=2.0	discard	band_mult: 1.5â†’2.0
2026-03-16T10:30:32	0.3552	443	4.84	2.6079	12.59	band_mult=1.0	discard	band_mult: 1.5â†’1.0
2026-03-16T10:31:16	-1.0894	381	6.41	1.2599	1.86	ibs_threshold=0.3	discard	ibs_threshold: 0.5â†’0.3
2026-03-16T10:31:16	-1.2790	363	6.88	1.1924	1.17	ibs_threshold=0.2	discard	ibs_threshold: 0.5â†’0.2
2026-03-16T10:32:04	-0.8970	429	7.40	1.3099	2.34	range_lookback=25	discard	range_lookback: Noneâ†’25
2026-03-16T10:32:04	-0.7446	425	6.53	1.3680	2.75	range_lookback=20	discard	range_lookback: Noneâ†’20
2026-03-16T10:32:04	-0.7696	425	6.35	1.3425	2.61	range_lookback=15	discard	range_lookback: Noneâ†’15
2026-03-16T10:32:04	-0.7910	427	5.10	1.3243	2.54	range_lookback=10	discard	range_lookback: Noneâ†’10
2026-03-16T10:32:53	0.1085	527	8.19	1.6745	5.70	max_hold_days=3	discard	max_hold_days: Noneâ†’3
2026-03-16T10:32:53	-0.8997	404	7.32	1.3212	2.32	max_hold_days=10	discard	max_hold_days: Noneâ†’10
2026-03-16T10:32:53	-0.8970	429	7.40	1.3099	2.34	max_hold_days=7	discard	max_hold_days: Noneâ†’7
2026-03-16T10:32:53	-0.9948	467	7.76	1.2990	2.17	max_hold_days=5	discard	max_hold_days: Noneâ†’5
2026-03-16T10:33:39	-1.2073	418	4.91	1.3891	2.04	atr_stop_mult=3.0	discard	atr_stop_mult: 2.5â†’3.0
2026-03-16T10:33:39	-0.6226	442	8.02	1.2749	2.69	atr_stop_mult=2.0	discard	atr_stop_mult: 2.5â†’2.0
2026-03-16T10:33:39	-0.8425	469	11.47	1.1007	1.31	atr_stop_mult=1.5	discard	atr_stop_mult: 2.5â†’1.5
