timestamp	sharpe	trades	max_dd_pct	pf	cagr_pct	params_changed	status	description
2026-03-11T11:45:10	-2.0382	168	5.53	1.1422	0.45		keep	baseline
2026-03-11T11:48:35	-3.3995	106	5.01	0.8910	-0.25		keep	baseline
2026-03-11T12:41:07	-3.3995	106	5.01	0.8910	-0.25		keep	baseline
2026-03-11T12:50:07	-3.3995	106	5.01	0.8910	-0.25		keep	baseline
2026-03-13T13:58:47	-0.0614	175	3.34	2.5306	3.94		keep	baseline
2026-03-13T14:26:02	0.3987	189	2.31	12.2610	34.23	stoch_period=5	keep	stoch_period: NoneŌåÆ5 (best of 4)
2026-03-13T14:26:02	-3.6615	181	4.07	1.1467	0.34	stoch_period=10	discard	stoch_period: NoneŌåÆ10
2026-03-13T14:26:02	-0.0614	175	3.34	2.5306	3.94	stoch_period=14	discard	stoch_period: NoneŌåÆ14
2026-03-13T14:26:02	-3.9799	171	4.13	1.1240	0.11	stoch_period=21	discard	stoch_period: NoneŌåÆ21
2026-03-13T14:26:36	-4.4707	92	1.65	1.3619	0.42	stoch_smooth=5	discard	stoch_smooth: NoneŌåÆ5
2026-03-13T14:26:36	0.3987	189	2.31	12.2610	34.23	stoch_smooth=3	discard	stoch_smooth: NoneŌåÆ3
2026-03-13T14:27:10	0.0000	0	0.00	0.0000	0.00	stoch_entry=10	discard	stoch_entry: NoneŌåÆ10
2026-03-13T14:27:10	-6.6444	67	1.51	1.0193	0.02	stoch_entry=15	discard	stoch_entry: NoneŌåÆ15
2026-03-13T14:27:10	0.3987	189	2.31	12.2610	34.23	stoch_entry=20	discard	stoch_entry: NoneŌåÆ20
2026-03-13T14:27:10	-0.0654	276	2.97	2.0092	4.08	stoch_entry=25	discard	stoch_entry: NoneŌåÆ25
2026-03-13T14:27:44	0.3938	187	1.91	13.6490	29.10	atr_stop_mult=2.5	discard	atr_stop_mult: NoneŌåÆ2.5
2026-03-13T14:27:44	0.3987	189	2.31	12.2610	34.23	atr_stop_mult=2.0	discard	atr_stop_mult: NoneŌåÆ2.0
2026-03-13T14:27:44	-0.0939	193	3.01	2.0393	3.81	atr_stop_mult=1.5	discard	atr_stop_mult: NoneŌåÆ1.5
2026-03-13T14:27:44	0.3829	176	1.73	15.8287	24.84	atr_stop_mult=3.0	discard	atr_stop_mult: NoneŌåÆ3.0
2026-03-13T14:28:17	0.3986	189	2.31	12.2573	34.23	max_hold_days=15	discard	max_hold_days: NoneŌåÆ15
2026-03-13T14:28:17	0.3987	189	2.31	12.2610	34.23	max_hold_days=10	discard	max_hold_days: NoneŌåÆ10
2026-03-13T14:28:17	0.3993	189	2.09	12.5865	34.40	max_hold_days=7	discard	max_hold_days: NoneŌåÆ7
2026-03-13T14:28:17	0.4006	201	1.29	14.1389	34.66	max_hold_days=5	discard	max_hold_days: NoneŌåÆ5
2026-03-13T14:28:52	0.3987	189	2.31	12.2610	34.23	sma200_filter=True	discard	sma200_filter: NoneŌåÆTrue
2026-03-13T14:28:52	0.4027	273	2.39	8.6595	35.13	sma200_filter=False	discard	sma200_filter: NoneŌåÆFalse
2026-03-13T23:37:46	0.3987	189	2.31	12.2610	34.23		keep	baseline
2026-03-13T23:38:24	-3.9799	171	4.13	1.1240	0.11	stoch_period=21	discard	stoch_period: 5ŌåÆ21
2026-03-13T23:38:24	-0.0614	175	3.34	2.5306	3.94	stoch_period=14	discard	stoch_period: 5ŌåÆ14
2026-03-13T23:38:24	-3.6615	181	4.07	1.1467	0.34	stoch_period=10	discard	stoch_period: 5ŌåÆ10
2026-03-13T23:38:57	-4.4707	92	1.65	1.3619	0.42	stoch_smooth=5	discard	stoch_smooth: NoneŌåÆ5
2026-03-13T23:38:57	0.3987	189	2.31	12.2610	34.23	stoch_smooth=3	discard	stoch_smooth: NoneŌåÆ3
2026-03-13T23:39:33	0.0000	0	0.00	0.0000	0.00	stoch_entry=10	discard	stoch_entry: NoneŌåÆ10
2026-03-13T23:39:33	-6.6444	67	1.51	1.0193	0.02	stoch_entry=15	discard	stoch_entry: NoneŌåÆ15
2026-03-13T23:39:33	0.3987	189	2.31	12.2610	34.23	stoch_entry=20	discard	stoch_entry: NoneŌåÆ20
2026-03-13T23:39:33	-0.0654	276	2.97	2.0092	4.08	stoch_entry=25	discard	stoch_entry: NoneŌåÆ25
2026-03-13T23:40:09	-0.0939	193	3.01	2.0393	3.81	atr_stop_mult=1.5	discard	atr_stop_mult: NoneŌåÆ1.5
2026-03-13T23:40:09	0.3829	176	1.73	15.8287	24.84	atr_stop_mult=3.0	discard	atr_stop_mult: NoneŌåÆ3.0
2026-03-13T23:40:09	0.3938	187	1.91	13.6490	29.10	atr_stop_mult=2.5	discard	atr_stop_mult: NoneŌåÆ2.5
2026-03-13T23:40:09	0.3987	189	2.31	12.2610	34.23	atr_stop_mult=2.0	discard	atr_stop_mult: NoneŌåÆ2.0
2026-03-13T23:40:45	0.4006	201	1.29	14.1389	34.66	max_hold_days=5	discard	max_hold_days: NoneŌåÆ5
2026-03-13T23:40:45	0.3987	189	2.31	12.2610	34.23	max_hold_days=10	discard	max_hold_days: NoneŌåÆ10
2026-03-13T23:40:45	0.3986	189	2.31	12.2573	34.23	max_hold_days=15	discard	max_hold_days: NoneŌåÆ15
2026-03-13T23:40:45	0.3993	189	2.09	12.5865	34.40	max_hold_days=7	discard	max_hold_days: NoneŌåÆ7
2026-03-14T02:38:21	0.3987	189	2.31	12.2610	34.23		keep	baseline
2026-03-14T02:39:03	-0.0614	175	3.34	2.5306	3.94	stoch_period=14	discard	stoch_period: 5ŌåÆ14
2026-03-14T02:39:03	-3.9799	171	4.13	1.1240	0.11	stoch_period=21	discard	stoch_period: 5ŌåÆ21
2026-03-14T02:39:03	-3.6615	181	4.07	1.1467	0.34	stoch_period=10	discard	stoch_period: 5ŌåÆ10
2026-03-14T02:39:38	-4.4707	92	1.65	1.3619	0.42	stoch_smooth=5	discard	stoch_smooth: NoneŌåÆ5
2026-03-14T02:39:38	0.3987	189	2.31	12.2610	34.23	stoch_smooth=3	discard	stoch_smooth: NoneŌåÆ3
2026-03-14T02:40:16	0.0000	0	0.00	0.0000	0.00	stoch_entry=10	discard	stoch_entry: NoneŌåÆ10
2026-03-14T02:40:16	-6.6444	67	1.51	1.0193	0.02	stoch_entry=15	discard	stoch_entry: NoneŌåÆ15
2026-03-14T02:40:16	0.3987	189	2.31	12.2610	34.23	stoch_entry=20	discard	stoch_entry: NoneŌåÆ20
2026-03-14T02:40:16	-0.0654	276	2.97	2.0092	4.08	stoch_entry=25	discard	stoch_entry: NoneŌåÆ25
2026-03-14T02:40:53	-0.0939	193	3.01	2.0393	3.81	atr_stop_mult=1.5	discard	atr_stop_mult: NoneŌåÆ1.5
2026-03-14T02:40:53	0.3938	187	1.91	13.6490	29.10	atr_stop_mult=2.5	discard	atr_stop_mult: NoneŌåÆ2.5
2026-03-14T02:40:53	0.3829	176	1.73	15.8287	24.84	atr_stop_mult=3.0	discard	atr_stop_mult: NoneŌåÆ3.0
2026-03-14T02:40:53	0.3987	189	2.31	12.2610	34.23	atr_stop_mult=2.0	discard	atr_stop_mult: NoneŌåÆ2.0
2026-03-14T02:41:28	0.3993	189	2.09	12.5865	34.40	max_hold_days=7	discard	max_hold_days: NoneŌåÆ7
2026-03-14T02:41:28	0.3987	189	2.31	12.2610	34.23	max_hold_days=10	discard	max_hold_days: NoneŌåÆ10
2026-03-14T02:41:28	0.3986	189	2.31	12.2573	34.23	max_hold_days=15	discard	max_hold_days: NoneŌåÆ15
2026-03-14T02:41:28	0.4006	201	1.29	14.1389	34.66	max_hold_days=5	discard	max_hold_days: NoneŌåÆ5
2026-03-14T10:02:54	0.3987	189	2.31	12.2610	34.23		keep	baseline
2026-03-14T10:03:37	-0.0614	175	3.34	2.5306	3.94	stoch_period=14	discard	stoch_period: 5ŌåÆ14
2026-03-14T10:03:37	-3.9799	171	4.13	1.1240	0.11	stoch_period=21	discard	stoch_period: 5ŌåÆ21
2026-03-14T10:03:37	-3.6615	181	4.07	1.1467	0.34	stoch_period=10	discard	stoch_period: 5ŌåÆ10
2026-03-14T10:04:18	-4.4707	92	1.65	1.3619	0.42	stoch_smooth=5	discard	stoch_smooth: NoneŌåÆ5
2026-03-14T10:04:18	0.3987	189	2.31	12.2610	34.23	stoch_smooth=3	discard	stoch_smooth: NoneŌåÆ3
2026-03-14T10:04:57	0.0000	0	0.00	0.0000	0.00	stoch_entry=10	discard	stoch_entry: NoneŌåÆ10
2026-03-14T10:04:57	-0.0654	276	2.97	2.0092	4.08	stoch_entry=25	discard	stoch_entry: NoneŌåÆ25
2026-03-14T10:04:57	0.3987	189	2.31	12.2610	34.23	stoch_entry=20	discard	stoch_entry: NoneŌåÆ20
2026-03-14T10:04:57	-6.6444	67	1.51	1.0193	0.02	stoch_entry=15	discard	stoch_entry: NoneŌåÆ15
2026-03-14T10:05:41	-0.0939	193	3.01	2.0393	3.81	atr_stop_mult=1.5	discard	atr_stop_mult: NoneŌåÆ1.5
2026-03-14T10:05:41	0.3987	189	2.31	12.2610	34.23	atr_stop_mult=2.0	discard	atr_stop_mult: NoneŌåÆ2.0
2026-03-14T10:05:41	0.3938	187	1.91	13.6490	29.10	atr_stop_mult=2.5	discard	atr_stop_mult: NoneŌåÆ2.5
2026-03-14T10:05:41	0.3829	176	1.73	15.8287	24.84	atr_stop_mult=3.0	discard	atr_stop_mult: NoneŌåÆ3.0
2026-03-14T10:06:22	0.3993	189	2.09	12.5865	34.40	max_hold_days=7	discard	max_hold_days: NoneŌåÆ7
2026-03-14T10:06:22	0.3986	189	2.31	12.2573	34.23	max_hold_days=15	discard	max_hold_days: NoneŌåÆ15
2026-03-14T10:06:22	0.3987	189	2.31	12.2610	34.23	max_hold_days=10	discard	max_hold_days: NoneŌåÆ10
2026-03-14T10:06:22	0.4006	201	1.29	14.1389	34.66	max_hold_days=5	discard	max_hold_days: NoneŌåÆ5
2026-03-15T02:34:48	0.1858	287	3.99	2.3784	6.62		keep	baseline
2026-03-15T02:35:29	-3.1548	266	5.11	1.1118	0.24	stoch_period=10	discard	stoch_period: 5ŌåÆ10
2026-03-15T02:35:29	-0.2244	256	2.94	2.0531	3.38	stoch_period=14	discard	stoch_period: 5ŌåÆ14
2026-03-15T02:35:29	-3.4047	243	4.62	1.0879	0.12	stoch_period=21	discard	stoch_period: 5ŌåÆ21
2026-03-15T02:36:07	-0.0835	188	2.98	2.3873	3.78	stoch_smooth=5	discard	stoch_smooth: NoneŌåÆ5
2026-03-15T02:36:07	0.1858	287	3.99	2.3784	6.62	stoch_smooth=3	discard	stoch_smooth: NoneŌåÆ3
2026-03-15T03:05:04	0.3991	227	2.68	10.2276	34.37	stoch_entry=15	keep	stoch_entry: NoneŌåÆ15 (best of 4)
2026-03-15T03:05:04	0.1858	287	3.99	2.3784	6.62	stoch_entry=20	discard	stoch_entry: NoneŌåÆ20
2026-03-15T03:05:04	0.4001	130	1.10	20.6043	34.55	stoch_entry=10	discard	stoch_entry: NoneŌåÆ10
2026-03-15T03:05:04	0.2830	338	2.87	2.7934	8.05	stoch_entry=25	discard	stoch_entry: NoneŌåÆ25
2026-03-15T03:05:38	0.3824	213	1.62	11.9608	24.79	atr_stop_mult=3.0	discard	atr_stop_mult: NoneŌåÆ3.0
2026-03-15T03:05:38	0.3935	223	2.03	10.9777	29.04	atr_stop_mult=2.5	discard	atr_stop_mult: NoneŌåÆ2.5
2026-03-15T03:05:38	0.3991	227	2.68	10.2276	34.37	atr_stop_mult=2.0	discard	atr_stop_mult: NoneŌåÆ2.0
2026-03-15T03:05:38	-0.0516	230	3.60	1.9120	4.18	atr_stop_mult=1.5	discard	atr_stop_mult: NoneŌåÆ1.5
2026-03-15T03:06:11	0.3991	227	2.68	10.2246	34.37	max_hold_days=15	discard	max_hold_days: NoneŌåÆ15
2026-03-15T03:06:11	0.4008	238	2.08	10.8130	34.70	max_hold_days=5	discard	max_hold_days: NoneŌåÆ5
2026-03-15T03:06:11	0.3993	229	2.68	10.6046	34.41	max_hold_days=7	discard	max_hold_days: NoneŌåÆ7
2026-03-15T03:06:11	0.3991	227	2.68	10.2276	34.37	max_hold_days=10	discard	max_hold_days: NoneŌåÆ10
2026-03-15T03:06:46	0.3991	227	2.68	10.2276	34.37	sma200_filter=True	discard	sma200_filter: NoneŌåÆTrue
2026-03-15T03:06:46	0.3998	312	2.30	7.6708	34.47	sma200_filter=False	discard	sma200_filter: NoneŌåÆFalse
2026-03-15T06:27:01	0.3991	227	2.68	10.2276	34.37		keep	baseline
2026-03-15T06:27:37	-3.6350	216	5.73	1.1613	0.26	stoch_period=14	discard	stoch_period: 5ŌåÆ14
2026-03-15T06:27:37	-3.4334	219	3.17	1.1623	0.45	stoch_period=10	discard	stoch_period: 5ŌåÆ10
2026-03-15T06:27:37	-3.5540	204	3.84	1.1806	0.32	stoch_period=21	discard	stoch_period: 5ŌåÆ21
2026-03-15T06:28:08	-4.2782	112	1.72	1.4301	0.58	stoch_smooth=5	discard	stoch_smooth: NoneŌåÆ5
2026-03-15T06:28:08	0.3991	227	2.68	10.2276	34.37	stoch_smooth=3	discard	stoch_smooth: NoneŌåÆ3
2026-03-15T06:28:42	0.4001	130	1.10	20.6043	34.55	stoch_entry=10	discard	stoch_entry: 15ŌåÆ10
2026-03-15T06:28:42	0.1858	287	3.99	2.3784	6.62	stoch_entry=20	discard	stoch_entry: 15ŌåÆ20
2026-03-15T06:28:42	0.2830	338	2.87	2.7934	8.05	stoch_entry=25	discard	stoch_entry: 15ŌåÆ25
2026-03-15T06:29:14	0.3935	223	2.03	10.9777	29.04	atr_stop_mult=2.5	discard	atr_stop_mult: NoneŌåÆ2.5
2026-03-15T06:29:14	0.3824	213	1.62	11.9608	24.79	atr_stop_mult=3.0	discard	atr_stop_mult: NoneŌåÆ3.0
2026-03-15T06:29:14	-0.0516	230	3.60	1.9120	4.18	atr_stop_mult=1.5	discard	atr_stop_mult: NoneŌåÆ1.5
2026-03-15T06:29:14	0.3991	227	2.68	10.2276	34.37	atr_stop_mult=2.0	discard	atr_stop_mult: NoneŌåÆ2.0
2026-03-15T06:29:47	0.4008	238	2.08	10.8130	34.70	max_hold_days=5	discard	max_hold_days: NoneŌåÆ5
2026-03-15T06:29:47	0.3991	227	2.68	10.2246	34.37	max_hold_days=15	discard	max_hold_days: NoneŌåÆ15
2026-03-15T06:29:47	0.3991	227	2.68	10.2276	34.37	max_hold_days=10	discard	max_hold_days: NoneŌåÆ10
2026-03-15T06:29:47	0.3993	229	2.68	10.6046	34.41	max_hold_days=7	discard	max_hold_days: NoneŌåÆ7
2026-03-15T10:10:31	0.3991	227	2.68	10.2276	34.37		keep	baseline
2026-03-15T10:11:03	-3.5540	204	3.84	1.1806	0.32	stoch_period=21	discard	stoch_period: 5ŌåÆ21
2026-03-15T10:11:03	-3.4334	219	3.17	1.1623	0.45	stoch_period=10	discard	stoch_period: 5ŌåÆ10
2026-03-15T10:11:03	-3.6350	216	5.73	1.1613	0.26	stoch_period=14	discard	stoch_period: 5ŌåÆ14
2026-03-15T10:11:34	-4.2782	112	1.72	1.4301	0.58	stoch_smooth=5	discard	stoch_smooth: NoneŌåÆ5
2026-03-15T10:11:34	0.3991	227	2.68	10.2276	34.37	stoch_smooth=3	discard	stoch_smooth: NoneŌåÆ3
2026-03-15T10:12:07	0.4001	130	1.10	20.6043	34.55	stoch_entry=10	discard	stoch_entry: 15ŌåÆ10
2026-03-15T10:12:07	0.1858	287	3.99	2.3784	6.62	stoch_entry=20	discard	stoch_entry: 15ŌåÆ20
2026-03-15T10:12:07	0.2830	338	2.87	2.7934	8.05	stoch_entry=25	discard	stoch_entry: 15ŌåÆ25
2026-03-15T10:12:38	0.3935	223	2.03	10.9777	29.04	atr_stop_mult=2.5	discard	atr_stop_mult: NoneŌåÆ2.5
2026-03-15T10:12:38	0.3991	227	2.68	10.2276	34.37	atr_stop_mult=2.0	discard	atr_stop_mult: NoneŌåÆ2.0
2026-03-15T10:12:38	-0.0516	230	3.60	1.9120	4.18	atr_stop_mult=1.5	discard	atr_stop_mult: NoneŌåÆ1.5
2026-03-15T10:12:38	0.3824	213	1.62	11.9608	24.79	atr_stop_mult=3.0	discard	atr_stop_mult: NoneŌåÆ3.0
2026-03-15T10:13:10	0.3993	229	2.68	10.6046	34.41	max_hold_days=7	discard	max_hold_days: NoneŌåÆ7
2026-03-15T10:13:10	0.4008	238	2.08	10.8130	34.70	max_hold_days=5	discard	max_hold_days: NoneŌåÆ5
2026-03-15T10:13:10	0.3991	227	2.68	10.2246	34.37	max_hold_days=15	discard	max_hold_days: NoneŌåÆ15
2026-03-15T10:13:10	0.3991	227	2.68	10.2276	34.37	max_hold_days=10	discard	max_hold_days: NoneŌåÆ10
2026-03-16T01:03:38	0.3991	227	2.68	10.2276	34.37		keep	baseline
2026-03-16T01:04:15	-3.5540	204	3.84	1.1806	0.32	stoch_period=21	discard	stoch_period: 5ŌåÆ21
2026-03-16T01:04:15	-3.4334	219	3.17	1.1623	0.45	stoch_period=10	discard	stoch_period: 5ŌåÆ10
2026-03-16T01:04:15	-3.6350	216	5.73	1.1613	0.26	stoch_period=14	discard	stoch_period: 5ŌåÆ14
2026-03-16T01:04:49	-4.2782	112	1.72	1.4301	0.58	stoch_smooth=5	discard	stoch_smooth: NoneŌåÆ5
2026-03-16T01:04:49	0.3991	227	2.68	10.2276	34.37	stoch_smooth=3	discard	stoch_smooth: NoneŌåÆ3
2026-03-16T01:05:26	0.4001	130	1.10	20.6043	34.55	stoch_entry=10	discard	stoch_entry: 15ŌåÆ10
2026-03-16T01:05:26	0.1858	287	3.99	2.3784	6.62	stoch_entry=20	discard	stoch_entry: 15ŌåÆ20
2026-03-16T01:05:26	0.2830	338	2.87	2.7934	8.05	stoch_entry=25	discard	stoch_entry: 15ŌåÆ25
2026-03-16T01:06:06	0.3824	213	1.62	11.9608	24.79	atr_stop_mult=3.0	discard	atr_stop_mult: NoneŌåÆ3.0
2026-03-16T01:06:06	0.3935	223	2.03	10.9777	29.04	atr_stop_mult=2.5	discard	atr_stop_mult: NoneŌåÆ2.5
2026-03-16T01:06:06	0.3991	227	2.68	10.2276	34.37	atr_stop_mult=2.0	discard	atr_stop_mult: NoneŌåÆ2.0
2026-03-16T01:06:06	-0.0516	230	3.60	1.9120	4.18	atr_stop_mult=1.5	discard	atr_stop_mult: NoneŌåÆ1.5
2026-03-16T01:06:41	0.4008	238	2.08	10.8130	34.70	max_hold_days=5	discard	max_hold_days: NoneŌåÆ5
2026-03-16T01:06:41	0.3991	227	2.68	10.2276	34.37	max_hold_days=10	discard	max_hold_days: NoneŌåÆ10
2026-03-16T01:06:41	0.3993	229	2.68	10.6046	34.41	max_hold_days=7	discard	max_hold_days: NoneŌåÆ7
2026-03-16T01:06:41	0.3991	227	2.68	10.2246	34.37	max_hold_days=15	discard	max_hold_days: NoneŌåÆ15
2026-03-16T02:46:54	0.3991	227	2.68	10.2276	34.37		keep	baseline
2026-03-16T02:47:26	-3.5540	204	3.84	1.1806	0.32	stoch_period=21	discard	stoch_period: 5ŌåÆ21
2026-03-16T02:47:26	-3.4334	219	3.17	1.1623	0.45	stoch_period=10	discard	stoch_period: 5ŌåÆ10
2026-03-16T02:47:26	-3.6350	216	5.73	1.1613	0.26	stoch_period=14	discard	stoch_period: 5ŌåÆ14
2026-03-16T02:47:56	-4.2782	112	1.72	1.4301	0.58	stoch_smooth=5	discard	stoch_smooth: NoneŌåÆ5
2026-03-16T02:47:56	0.3991	227	2.68	10.2276	34.37	stoch_smooth=3	discard	stoch_smooth: NoneŌåÆ3
2026-03-16T02:48:30	0.4001	130	1.10	20.6043	34.55	stoch_entry=10	discard	stoch_entry: 15ŌåÆ10
2026-03-16T02:48:30	0.1858	287	3.99	2.3784	6.62	stoch_entry=20	discard	stoch_entry: 15ŌåÆ20
2026-03-16T02:48:30	0.2830	338	2.87	2.7934	8.05	stoch_entry=25	discard	stoch_entry: 15ŌåÆ25
2026-03-16T02:49:04	0.3824	213	1.62	11.9608	24.79	atr_stop_mult=3.0	discard	atr_stop_mult: NoneŌåÆ3.0
2026-03-16T02:49:04	0.3991	227	2.68	10.2276	34.37	atr_stop_mult=2.0	discard	atr_stop_mult: NoneŌåÆ2.0
2026-03-16T02:49:04	-0.0516	230	3.60	1.9120	4.18	atr_stop_mult=1.5	discard	atr_stop_mult: NoneŌåÆ1.5
2026-03-16T02:49:04	0.3935	223	2.03	10.9777	29.04	atr_stop_mult=2.5	discard	atr_stop_mult: NoneŌåÆ2.5
2026-03-16T02:49:36	0.3991	227	2.68	10.2276	34.37	max_hold_days=10	discard	max_hold_days: NoneŌåÆ10
2026-03-16T02:49:36	0.3991	227	2.68	10.2246	34.37	max_hold_days=15	discard	max_hold_days: NoneŌåÆ15
2026-03-16T02:49:36	0.3993	229	2.68	10.6046	34.41	max_hold_days=7	discard	max_hold_days: NoneŌåÆ7
2026-03-16T02:49:36	0.4008	238	2.08	10.8130	34.70	max_hold_days=5	discard	max_hold_days: NoneŌåÆ5
2026-03-16T06:12:35	0.4012	229	2.67	10.3432	34.80		keep	baseline
2026-03-16T06:13:14	-3.3625	221	3.00	1.1854	0.51	stoch_period=10	discard	stoch_period: 5ŌåÆ10
2026-03-16T06:13:14	-3.3839	208	3.90	1.2319	0.45	stoch_period=21	discard	stoch_period: 5ŌåÆ21
2026-03-16T06:13:14	-3.5250	218	5.76	1.1350	0.32	stoch_period=14	discard	stoch_period: 5ŌåÆ14
2026-03-16T06:13:49	-4.3008	112	1.72	1.4468	0.60	stoch_smooth=5	discard	stoch_smooth: NoneŌåÆ5
2026-03-16T06:13:49	0.4012	229	2.67	10.3432	34.80	stoch_smooth=3	discard	stoch_smooth: NoneŌåÆ3
2026-03-16T06:14:28	0.4001	131	1.10	20.7304	34.57	stoch_entry=10	discard	stoch_entry: 15ŌåÆ10
2026-03-16T06:14:28	0.1874	289	3.98	2.3850	6.64	stoch_entry=20	discard	stoch_entry: 15ŌåÆ20
2026-03-16T06:14:28	0.2923	342	2.86	2.8208	8.18	stoch_entry=25	discard	stoch_entry: 15ŌåÆ25
2026-03-16T06:15:04	0.3961	225	1.88	11.3073	29.44	atr_stop_mult=2.5	discard	atr_stop_mult: NoneŌåÆ2.5
2026-03-16T06:15:04	0.3848	216	1.61	12.2584	25.11	atr_stop_mult=3.0	discard	atr_stop_mult: NoneŌåÆ3.0
2026-03-16T06:15:04	-0.0104	232	3.64	2.0156	4.54	atr_stop_mult=1.5	discard	atr_stop_mult: NoneŌåÆ1.5
2026-03-16T06:15:04	0.4012	229	2.67	10.3432	34.80	atr_stop_mult=2.0	discard	atr_stop_mult: NoneŌåÆ2.0
2026-03-16T06:15:39	0.4012	229	2.67	10.3401	34.79	max_hold_days=15	discard	max_hold_days: NoneŌåÆ15
2026-03-16T06:15:39	0.4016	231	2.57	10.7424	34.90	max_hold_days=7	discard	max_hold_days: NoneŌåÆ7
2026-03-16T06:15:39	0.4012	229	2.67	10.3432	34.80	max_hold_days=10	discard	max_hold_days: NoneŌåÆ10
2026-03-16T06:15:39	0.4013	240	2.08	10.8702	34.83	max_hold_days=5	discard	max_hold_days: NoneŌåÆ5
2026-03-16T13:30:40	0.9898	727	13.04	2.4905	49.07		keep	baseline
2026-03-16T13:31:24	-1.4057	232	3.75	1.1926	1.12	stoch_period=10	discard	stoch_period: 5ŌåÆ10
2026-03-16T13:31:24	-1.1165	220	6.49	1.3624	1.75	stoch_period=21	discard	stoch_period: 5ŌåÆ21
2026-03-16T13:31:24	-1.3994	233	8.96	1.3244	1.29	stoch_period=14	discard	stoch_period: 5ŌåÆ14
2026-03-16T13:32:07	-1.6780	129	4.41	1.4346	1.33	stoch_smooth=5	discard	stoch_smooth: NoneŌåÆ5
2026-03-16T13:32:07	0.1515	238	4.90	1.9293	6.27	stoch_smooth=3	discard	stoch_smooth: NoneŌåÆ3
2026-03-16T13:32:52	0.4150	146	2.70	12.8159	52.47	stoch_entry=10	discard	stoch_entry: 15ŌåÆ10
2026-03-16T13:32:52	0.3532	303	6.26	2.0764	11.51	stoch_entry=20	discard	stoch_entry: 15ŌåÆ20
2026-03-16T13:32:52	0.4877	358	3.75	2.4149	15.97	stoch_entry=25	discard	stoch_entry: 15ŌåÆ25
2026-03-16T13:33:36	0.1336	235	3.94	2.1267	6.04	atr_stop_mult=2.5	discard	atr_stop_mult: NoneŌåÆ2.5
2026-03-16T13:33:36	0.0260	230	3.02	2.1335	4.84	atr_stop_mult=3.0	discard	atr_stop_mult: NoneŌåÆ3.0
2026-03-16T13:33:36	0.1515	238	4.90	1.9293	6.27	atr_stop_mult=2.0	discard	atr_stop_mult: NoneŌåÆ2.0
2026-03-16T13:33:36	0.2795	243	7.17	1.9433	8.86	atr_stop_mult=1.5	discard	atr_stop_mult: NoneŌåÆ1.5
2026-03-16T13:34:19	0.1686	241	4.68	1.9724	6.49	max_hold_days=7	discard	max_hold_days: NoneŌåÆ7
2026-03-16T13:34:19	0.1512	238	4.94	1.9295	6.27	max_hold_days=15	discard	max_hold_days: NoneŌåÆ15
2026-03-16T13:34:19	0.1515	238	4.90	1.9293	6.27	max_hold_days=10	discard	max_hold_days: NoneŌåÆ10
2026-03-16T13:34:19	0.1459	254	4.58	1.8986	6.20	max_hold_days=5	discard	max_hold_days: NoneŌåÆ5
