timestamp	sharpe	trades	max_dd_pct	pf	cagr_pct	params_changed	status	description
2026-03-11T11:45:22	0.0810	190	5.31	2.0402	5.35		keep	baseline
2026-03-11T11:48:41	0.0093	132	5.75	2.2429	4.46		keep	baseline
2026-03-11T12:41:14	0.0093	132	5.75	2.2429	4.46		keep	baseline
2026-03-11T12:50:13	0.0093	132	5.75	2.2429	4.46		keep	baseline
2026-03-13T14:29:26	-3.3647	156	5.85	0.9929	-0.19		keep	baseline
2026-03-13T14:57:47	-2.4969	168	3.37	1.2727	1.06	wr_period=10	keep	wr_period: None→10 (best of 3)
2026-03-13T14:57:47	-3.3647	156	5.85	0.9929	-0.19	wr_period=14	discard	wr_period: None→14
2026-03-13T14:57:47	-3.3987	136	3.61	0.9927	-0.19	wr_period=21	discard	wr_period: None→21
2026-03-13T14:58:20	0.0000	0	0.00	0.0000	0.00	wr_entry=-95	discard	wr_entry: None→-95
2026-03-13T14:58:20	-13.8593	8	0.68	4.1303	0.24	wr_entry=-90	discard	wr_entry: None→-90
2026-03-13T14:58:20	-3.7845	126	4.39	0.9332	-0.06	wr_entry=-85	discard	wr_entry: None→-85
2026-03-13T14:58:20	-2.4969	168	3.37	1.2727	1.06	wr_entry=-80	discard	wr_entry: None→-80
2026-03-13T23:41:20	-2.4969	168	3.37	1.2727	1.06		keep	baseline
2026-03-13T23:41:52	-3.3987	136	3.61	0.9927	-0.19	wr_period=21	discard	wr_period: 10→21
2026-03-13T23:41:52	-3.3647	156	5.85	0.9929	-0.19	wr_period=14	discard	wr_period: 10→14
2026-03-13T23:42:25	0.0000	0	0.00	0.0000	0.00	wr_entry=-95	discard	wr_entry: None→-95
2026-03-13T23:42:25	-13.8593	8	0.68	4.1303	0.24	wr_entry=-90	discard	wr_entry: None→-90
2026-03-13T23:42:25	-3.7845	126	4.39	0.9332	-0.06	wr_entry=-85	discard	wr_entry: None→-85
2026-03-13T23:42:25	-2.4969	168	3.37	1.2727	1.06	wr_entry=-80	discard	wr_entry: None→-80
2026-03-14T00:11:12	-2.0282	178	4.89	1.0879	0.71	atr_stop_mult=1.5	keep	atr_stop_mult: None→1.5 (best of 4)
2026-03-14T00:11:12	-4.1395	151	2.82	1.2768	0.67	atr_stop_mult=3.0	discard	atr_stop_mult: None→3.0
2026-03-14T00:11:12	-3.4621	156	2.88	1.4392	0.78	atr_stop_mult=2.5	discard	atr_stop_mult: None→2.5
2026-03-14T00:11:12	-2.4969	168	3.37	1.2727	1.06	atr_stop_mult=2.0	discard	atr_stop_mult: None→2.0
2026-03-14T00:39:39	-1.6028	214	3.89	1.4077	1.64	max_hold_days=7	keep	max_hold_days: None→7 (best of 4)
2026-03-14T00:39:39	-1.9044	255	5.71	1.1425	1.00	max_hold_days=5	discard	max_hold_days: None→5
2026-03-14T00:39:39	-1.9347	156	4.35	1.3167	1.00	max_hold_days=15	discard	max_hold_days: None→15
2026-03-14T00:39:39	-2.0282	178	4.89	1.0879	0.71	max_hold_days=10	discard	max_hold_days: None→10
2026-03-14T02:42:05	-1.6028	214	3.89	1.4077	1.64		keep	baseline
2026-03-14T02:42:39	-2.1398	185	6.03	1.2186	0.65	wr_period=21	discard	wr_period: 10→21
2026-03-14T02:42:39	-2.0323	205	6.65	1.2461	0.83	wr_period=14	discard	wr_period: 10→14
2026-03-14T02:43:14	0.0000	0	0.00	0.0000	0.00	wr_entry=-95	discard	wr_entry: None→-95
2026-03-14T02:43:14	-10.3521	9	0.47	10.3978	0.41	wr_entry=-90	discard	wr_entry: None→-90
2026-03-14T02:43:14	-1.8461	158	2.20	1.4251	1.59	wr_entry=-85	discard	wr_entry: None→-85
2026-03-14T02:43:14	-1.6028	214	3.89	1.4077	1.64	wr_entry=-80	discard	wr_entry: None→-80
2026-03-14T02:43:47	-4.5033	179	2.73	1.0867	0.33	atr_stop_mult=3.0	discard	atr_stop_mult: 1.5→3.0
2026-03-14T02:43:47	-3.4187	191	2.15	1.3260	0.90	atr_stop_mult=2.5	discard	atr_stop_mult: 1.5→2.5
2026-03-14T02:43:47	-2.1821	200	2.57	1.6380	1.57	atr_stop_mult=2.0	discard	atr_stop_mult: 1.5→2.0
2026-03-14T02:44:23	-1.9044	255	5.71	1.1425	1.00	max_hold_days=5	discard	max_hold_days: 7→5
2026-03-14T02:44:23	-2.0282	178	4.89	1.0879	0.71	max_hold_days=10	discard	max_hold_days: 7→10
2026-03-14T02:44:23	-1.9347	156	4.35	1.3167	1.00	max_hold_days=15	discard	max_hold_days: 7→15
2026-03-14T03:13:33	-1.1208	254	3.45	1.5256	2.45	sma200_filter=False	keep	sma200_filter: None→False (best of 2)
2026-03-14T03:13:33	-1.6028	214	3.89	1.4077	1.64	sma200_filter=True	discard	sma200_filter: None→True
2026-03-14T05:02:25	-1.1208	254	3.45	1.5256	2.45		keep	baseline
2026-03-14T05:30:36	0.1968	228	3.85	2.4610	6.92	wr_period=21	keep	wr_period: 10→21 (best of 2)
2026-03-14T05:30:36	-1.3465	241	4.17	1.4298	1.88	wr_period=14	discard	wr_period: 10→14
2026-03-14T05:31:12	0.0000	0	0.00	0.0000	0.00	wr_entry=-95	discard	wr_entry: None→-95
2026-03-14T05:31:12	-7.6264	19	1.73	1.1034	0.04	wr_entry=-90	discard	wr_entry: None→-90
2026-03-14T05:31:12	0.0859	196	4.52	2.1346	5.42	wr_entry=-85	discard	wr_entry: None→-85
2026-03-14T05:31:12	0.1968	228	3.85	2.4610	6.92	wr_entry=-80	discard	wr_entry: None→-80
2026-03-14T05:31:47	-0.2860	201	1.75	2.3955	2.96	atr_stop_mult=3.0	discard	atr_stop_mult: 1.5→3.0
2026-03-14T05:31:47	-0.1576	208	3.01	2.1682	3.46	atr_stop_mult=2.5	discard	atr_stop_mult: 1.5→2.5
2026-03-14T05:31:47	0.0430	213	3.49	2.6135	4.99	atr_stop_mult=2.0	discard	atr_stop_mult: 1.5→2.0
2026-03-14T05:32:23	0.0599	285	4.72	1.7462	5.07	max_hold_days=5	discard	max_hold_days: 7→5
2026-03-14T05:32:23	-1.1455	149	5.12	1.6645	2.30	max_hold_days=15	discard	max_hold_days: 7→15
2026-03-14T05:32:23	-1.4921	184	5.20	1.3342	1.47	max_hold_days=10	discard	max_hold_days: 7→10
2026-03-14T05:32:54	-2.1398	185	6.03	1.2186	0.65	sma200_filter=True	discard	sma200_filter: False→True
2026-03-14T10:07:05	0.1968	228	3.85	2.4610	6.92		keep	baseline
2026-03-14T10:07:46	-1.1208	254	3.45	1.5256	2.45	wr_period=10	discard	wr_period: 21→10
2026-03-14T10:07:46	-1.3465	241	4.17	1.4298	1.88	wr_period=14	discard	wr_period: 21→14
2026-03-14T10:08:30	0.0000	0	0.00	0.0000	0.00	wr_entry=-95	discard	wr_entry: None→-95
2026-03-14T10:08:30	-7.6264	19	1.73	1.1034	0.04	wr_entry=-90	discard	wr_entry: None→-90
2026-03-14T10:08:30	0.1968	228	3.85	2.4610	6.92	wr_entry=-80	discard	wr_entry: None→-80
2026-03-14T10:08:30	0.0859	196	4.52	2.1346	5.42	wr_entry=-85	discard	wr_entry: None→-85
2026-03-14T10:09:15	-0.1576	208	3.01	2.1682	3.46	atr_stop_mult=2.5	discard	atr_stop_mult: 1.5→2.5
2026-03-14T10:09:15	-0.2860	201	1.75	2.3955	2.96	atr_stop_mult=3.0	discard	atr_stop_mult: 1.5→3.0
2026-03-14T10:09:15	0.0430	213	3.49	2.6135	4.99	atr_stop_mult=2.0	discard	atr_stop_mult: 1.5→2.0
2026-03-14T10:09:57	-1.4921	184	5.20	1.3342	1.47	max_hold_days=10	discard	max_hold_days: 7→10
2026-03-14T10:09:57	-1.1455	149	5.12	1.6645	2.30	max_hold_days=15	discard	max_hold_days: 7→15
2026-03-14T10:09:57	0.0599	285	4.72	1.7462	5.07	max_hold_days=5	discard	max_hold_days: 7→5
2026-03-14T10:10:32	-2.1398	185	6.03	1.2186	0.65	sma200_filter=True	discard	sma200_filter: False→True
2026-03-14T23:09:58	0.1968	228	3.85	2.4610	6.92		keep	baseline
2026-03-14T23:10:35	-1.3563	241	4.18	1.4271	1.87	wr_period=14	discard	wr_period: 21→14
2026-03-14T23:10:35	-1.1208	254	3.45	1.5256	2.45	wr_period=10	discard	wr_period: 21→10
2026-03-14T23:11:12	0.0000	0	0.00	0.0000	0.00	wr_entry=-95	discard	wr_entry: None→-95
2026-03-14T23:11:12	-7.6264	19	1.73	1.1034	0.04	wr_entry=-90	discard	wr_entry: None→-90
2026-03-14T23:11:12	0.0891	196	4.32	2.1505	5.46	wr_entry=-85	discard	wr_entry: None→-85
2026-03-14T23:11:12	0.1968	228	3.85	2.4610	6.92	wr_entry=-80	discard	wr_entry: None→-80
2026-03-14T23:11:46	-0.1576	208	3.01	2.1682	3.46	atr_stop_mult=2.5	discard	atr_stop_mult: 1.5→2.5
2026-03-14T23:11:46	0.0430	213	3.49	2.6135	4.99	atr_stop_mult=2.0	discard	atr_stop_mult: 1.5→2.0
2026-03-14T23:11:46	-0.2860	201	1.75	2.3955	2.96	atr_stop_mult=3.0	discard	atr_stop_mult: 1.5→3.0
2026-03-14T23:12:22	-1.5303	184	4.87	1.3339	1.44	max_hold_days=10	discard	max_hold_days: 7→10
2026-03-14T23:12:22	0.0400	283	4.72	1.7343	4.81	max_hold_days=5	discard	max_hold_days: 7→5
2026-03-14T23:12:22	-1.4661	148	5.55	1.4978	1.73	max_hold_days=15	discard	max_hold_days: 7→15
2026-03-14T23:12:54	-2.1023	182	4.79	1.2839	0.85	sma200_filter=True	discard	sma200_filter: False→True
2026-03-15T03:07:25	-1.5009	256	3.56	1.2689	1.41		keep	baseline
2026-03-15T03:37:18	-0.0480	293	3.74	1.6342	4.21	wr_period=10	keep	wr_period: 21→10 (best of 2)
2026-03-15T03:37:18	-0.1038	277	4.81	1.6151	3.72	wr_period=14	discard	wr_period: 21→14
2026-03-15T06:30:28	-0.0480	293	3.74	1.6342	4.21		keep	baseline
2026-03-15T06:31:08	-1.5009	256	3.56	1.2689	1.41	wr_period=21	discard	wr_period: 10→21
2026-03-15T06:31:08	-0.1038	277	4.81	1.6151	3.72	wr_period=14	discard	wr_period: 10→14
2026-03-15T06:59:45	-0.0307	275	3.23	1.7150	4.37	wr_entry=-85	keep	wr_entry: None→-85 (best of 4)
2026-03-15T06:59:45	-0.0377	220	3.54	1.8239	4.29	wr_entry=-95	discard	wr_entry: None→-95
2026-03-15T06:59:45	-1.1929	254	3.46	1.4917	2.29	wr_entry=-90	discard	wr_entry: None→-90
2026-03-15T06:59:45	-0.0480	293	3.74	1.6342	4.21	wr_entry=-80	discard	wr_entry: None→-80
2026-03-15T07:00:24	-2.8368	238	3.89	1.1889	0.59	atr_stop_mult=2.5	discard	atr_stop_mult: 1.5→2.5
2026-03-15T07:00:24	-0.2465	255	3.09	1.7787	3.21	atr_stop_mult=2.0	discard	atr_stop_mult: 1.5→2.0
2026-03-15T07:00:24	-3.6017	234	2.51	1.2290	0.66	atr_stop_mult=3.0	discard	atr_stop_mult: 1.5→3.0
2026-03-15T07:00:59	-1.9185	228	4.87	1.0783	0.44	max_hold_days=10	discard	max_hold_days: 7→10
2026-03-15T07:00:59	-1.7830	328	4.27	1.0953	0.66	max_hold_days=5	discard	max_hold_days: 7→5
2026-03-15T07:00:59	-1.5048	192	3.09	1.2504	1.27	max_hold_days=15	discard	max_hold_days: 7→15
2026-03-15T07:01:30	-0.1659	242	4.31	1.5455	3.17	sma200_filter=True	discard	sma200_filter: False→True
2026-03-15T10:13:44	-0.0307	275	3.23	1.7150	4.37		keep	baseline
2026-03-15T10:40:50	0.1261	262	2.48	2.1826	5.77	wr_period=14	keep	wr_period: 10→14 (best of 2)
2026-03-15T10:40:50	-0.9403	247	1.98	1.6109	2.71	wr_period=21	discard	wr_period: 10→21
2026-03-15T10:41:25	-0.0880	205	4.36	1.8390	3.84	wr_entry=-95	discard	wr_entry: -85→-95
2026-03-15T10:41:25	-1.3563	241	4.18	1.4271	1.87	wr_entry=-90	discard	wr_entry: -85→-90
2026-03-15T10:41:25	-0.1038	277	4.81	1.6151	3.72	wr_entry=-80	discard	wr_entry: -85→-80
2026-03-15T10:41:59	-3.5200	226	2.17	1.3426	0.86	atr_stop_mult=3.0	discard	atr_stop_mult: 1.5→3.0
2026-03-15T10:41:59	-2.5536	235	2.66	1.4227	1.26	atr_stop_mult=2.5	discard	atr_stop_mult: 1.5→2.5
2026-03-15T10:41:59	-1.7225	243	3.75	1.5608	1.85	atr_stop_mult=2.0	discard	atr_stop_mult: 1.5→2.0
2026-03-15T10:42:34	-1.6270	175	2.84	1.2721	1.26	max_hold_days=15	discard	max_hold_days: 7→15
2026-03-15T10:42:34	-1.6161	209	3.91	1.2174	1.10	max_hold_days=10	discard	max_hold_days: 7→10
2026-03-15T10:42:34	-1.6825	312	4.43	1.1095	0.73	max_hold_days=5	discard	max_hold_days: 7→5
2026-03-15T10:43:05	-1.9172	227	3.68	1.2299	0.84	sma200_filter=True	discard	sma200_filter: False→True
2026-03-16T01:07:19	0.1261	262	2.48	2.1826	5.77		keep	baseline
2026-03-16T01:07:55	-0.9403	247	1.98	1.6109	2.71	wr_period=21	discard	wr_period: 14→21
2026-03-16T01:07:55	-0.0307	275	3.23	1.7150	4.37	wr_period=10	discard	wr_period: 14→10
2026-03-16T01:08:32	-0.0880	205	4.36	1.8390	3.84	wr_entry=-95	discard	wr_entry: -85→-95
2026-03-16T01:08:32	-1.3563	241	4.18	1.4271	1.87	wr_entry=-90	discard	wr_entry: -85→-90
2026-03-16T01:08:32	-0.1038	277	4.81	1.6151	3.72	wr_entry=-80	discard	wr_entry: -85→-80
2026-03-16T01:09:10	-1.7225	243	3.75	1.5608	1.85	atr_stop_mult=2.0	discard	atr_stop_mult: 1.5→2.0
2026-03-16T01:09:10	-2.5536	235	2.66	1.4227	1.26	atr_stop_mult=2.5	discard	atr_stop_mult: 1.5→2.5
2026-03-16T01:09:10	-3.5200	226	2.17	1.3426	0.86	atr_stop_mult=3.0	discard	atr_stop_mult: 1.5→3.0
2026-03-16T01:09:44	-1.6161	209	3.91	1.2174	1.10	max_hold_days=10	discard	max_hold_days: 7→10
2026-03-16T01:09:44	-1.6825	312	4.43	1.1095	0.73	max_hold_days=5	discard	max_hold_days: 7→5
2026-03-16T01:09:44	-1.6270	175	2.84	1.2721	1.26	max_hold_days=15	discard	max_hold_days: 7→15
2026-03-16T01:10:17	-1.9172	227	3.68	1.2299	0.84	sma200_filter=True	discard	sma200_filter: False→True
2026-03-16T02:50:12	0.1261	262	2.48	2.1826	5.77		keep	baseline
2026-03-16T02:50:46	-0.9403	247	1.98	1.6109	2.71	wr_period=21	discard	wr_period: 14→21
2026-03-16T02:50:46	-0.0307	275	3.23	1.7150	4.37	wr_period=10	discard	wr_period: 14→10
2026-03-16T02:51:23	-0.0880	205	4.36	1.8390	3.84	wr_entry=-95	discard	wr_entry: -85→-95
2026-03-16T02:51:23	-1.3563	241	4.18	1.4271	1.87	wr_entry=-90	discard	wr_entry: -85→-90
2026-03-16T02:51:23	-0.1038	277	4.81	1.6151	3.72	wr_entry=-80	discard	wr_entry: -85→-80
2026-03-16T02:51:59	-1.7225	243	3.75	1.5608	1.85	atr_stop_mult=2.0	discard	atr_stop_mult: 1.5→2.0
2026-03-16T02:51:59	-3.5200	226	2.17	1.3426	0.86	atr_stop_mult=3.0	discard	atr_stop_mult: 1.5→3.0
2026-03-16T02:51:59	-2.5536	235	2.66	1.4227	1.26	atr_stop_mult=2.5	discard	atr_stop_mult: 1.5→2.5
2026-03-16T02:52:33	-1.6270	175	2.84	1.2721	1.26	max_hold_days=15	discard	max_hold_days: 7→15
2026-03-16T02:52:33	-1.6161	209	3.91	1.2174	1.10	max_hold_days=10	discard	max_hold_days: 7→10
2026-03-16T02:52:33	-1.6825	312	4.43	1.1095	0.73	max_hold_days=5	discard	max_hold_days: 7→5
2026-03-16T02:53:04	-1.9172	227	3.68	1.2299	0.84	sma200_filter=True	discard	sma200_filter: False→True
2026-03-16T06:16:17	0.1776	269	2.88	2.2985	6.24		keep	baseline
2026-03-16T06:16:55	-1.0056	257	1.95	1.5046	2.48	wr_period=21	discard	wr_period: 14→21
2026-03-16T06:16:55	0.0056	279	2.53	1.8042	4.69	wr_period=10	discard	wr_period: 14→10
2026-03-16T06:17:38	-0.1080	210	5.09	1.8417	3.67	wr_entry=-95	discard	wr_entry: -85→-95
2026-03-16T06:17:38	-1.4280	247	4.81	1.3950	1.78	wr_entry=-90	discard	wr_entry: -85→-90
2026-03-16T06:17:38	-0.0387	283	4.33	1.7263	4.28	wr_entry=-80	discard	wr_entry: -85→-80
2026-03-16T06:18:16	-3.3514	235	2.08	1.3483	0.93	atr_stop_mult=3.0	discard	atr_stop_mult: 1.5→3.0
2026-03-16T06:18:16	-1.9349	251	3.75	1.3439	1.42	atr_stop_mult=2.0	discard	atr_stop_mult: 1.5→2.0
2026-03-16T06:18:16	-2.5608	243	2.67	1.3392	1.09	atr_stop_mult=2.5	discard	atr_stop_mult: 1.5→2.5
2026-03-16T06:18:55	-0.0123	224	3.59	1.7338	4.51	max_hold_days=10	discard	max_hold_days: 7→10
2026-03-16T06:18:55	0.0512	180	2.74	2.0221	5.09	max_hold_days=15	discard	max_hold_days: 7→15
2026-03-16T06:18:55	-1.4889	323	4.45	1.1592	1.09	max_hold_days=5	discard	max_hold_days: 7→5
2026-03-16T06:19:32	-1.7563	233	3.63	1.2893	1.13	sma200_filter=True	discard	sma200_filter: False→True
2026-03-16T10:23:16	0.9664	725	13.25	2.4409	47.57		keep	baseline
2026-03-16T10:24:00	0.4061	264	4.80	1.9487	13.48	wr_period=21	discard	wr_period: 14→21
2026-03-16T10:24:00	0.2480	285	4.94	1.5816	8.27	wr_period=10	discard	wr_period: 14→10
2026-03-16T10:24:44	0.2079	214	8.27	1.9155	7.52	wr_entry=-95	discard	wr_entry: -85→-95
2026-03-16T10:24:44	0.2690	251	8.49	1.8509	8.65	wr_entry=-90	discard	wr_entry: -85→-90
2026-03-16T10:24:44	0.1407	282	7.06	1.5152	6.28	wr_entry=-80	discard	wr_entry: -85→-80
2026-03-16T10:25:31	-1.3735	251	7.09	1.3540	1.66	atr_stop_mult=3.0	discard	atr_stop_mult: 1.5→3.0
2026-03-16T10:25:31	-0.5808	256	5.75	1.6330	3.26	atr_stop_mult=2.5	discard	atr_stop_mult: 1.5→2.5
2026-03-16T10:25:31	0.3035	263	7.79	2.1793	9.27	atr_stop_mult=2.0	discard	atr_stop_mult: 1.5→2.0
2026-03-16T10:26:18	-0.8249	329	10.63	1.1231	1.37	max_hold_days=5	discard	max_hold_days: 7→5
2026-03-16T10:26:18	0.2400	183	7.58	1.7826	8.15	max_hold_days=15	discard	max_hold_days: 7→15
2026-03-16T10:26:18	0.2562	225	6.96	1.6758	8.46	max_hold_days=10	discard	max_hold_days: 7→10
2026-03-16T10:27:05	-0.5116	236	6.96	1.3802	2.63	sma200_filter=True	discard	sma200_filter: False→True
2026-03-16T13:37:00	0.9771	725	13.15	2.4672	48.21		keep	baseline
2026-03-16T13:37:47	0.4206	264	4.60	1.9883	13.87	wr_period=21	discard	wr_period: 14→21
2026-03-16T13:37:47	0.2686	285	4.54	1.6168	8.66	wr_period=10	discard	wr_period: 14→10
2026-03-16T13:38:37	0.2142	214	8.28	1.9276	7.64	wr_entry=-95	discard	wr_entry: -85→-95
2026-03-16T13:38:37	0.2946	251	8.33	1.8941	9.14	wr_entry=-90	discard	wr_entry: -85→-90
2026-03-16T13:38:37	0.1810	281	6.80	1.5624	7.02	wr_entry=-80	discard	wr_entry: -85→-80
2026-03-16T13:39:27	0.3119	262	7.60	2.2059	9.43	atr_stop_mult=2.0	discard	atr_stop_mult: 1.5→2.0
2026-03-16T13:39:27	-0.4883	256	5.62	1.6900	3.52	atr_stop_mult=2.5	discard	atr_stop_mult: 1.5→2.5
2026-03-16T13:39:27	-1.2680	251	7.11	1.3954	1.85	atr_stop_mult=3.0	discard	atr_stop_mult: 1.5→3.0
2026-03-16T13:40:17	0.2277	183	8.50	1.7719	7.92	max_hold_days=15	discard	max_hold_days: 7→15
2026-03-16T13:40:17	-0.7676	331	10.68	1.1394	1.56	max_hold_days=5	discard	max_hold_days: 7→5
2026-03-16T13:40:17	0.2634	225	6.77	1.6877	8.60	max_hold_days=10	discard	max_hold_days: 7→10
2026-03-16T13:41:02	-0.4608	236	6.91	1.4078	2.85	sma200_filter=True	discard	sma200_filter: False→True
